title,price,availability,rating,link
A Distant Mirror: The Calamitous 14th Century,£14.58,In stock,Three,https://books.toscrape.com/a-distant-mirror-the-calamitous-14th-century_652/index.html
A Brush of Wings (Angels Walking #3),£55.51,In stock,One,https://books.toscrape.com/a-brush-of-wings-angels-walking-3_651/index.html
1491: New Revelations of the Americas Before Columbus,£21.80,In stock,Three,https://books.toscrape.com/1491-new-revelations-of-the-americas-before-columbus_650/index.html
"The Three Searches, Meaning, and the Story",£13.33,In stock,Three,https://books.toscrape.com/the-three-searches-meaning-and-the-story_649/index.html
Searching for Meaning in Gailana,£38.73,In stock,One,https://books.toscrape.com/searching-for-meaning-in-gailana_648/index.html
Rook,£37.86,In stock,Four,https://books.toscrape.com/rook_647/index.html
My Kitchen Year: 136 Recipes That Saved My Life,£11.53,In stock,Two,https://books.toscrape.com/my-kitchen-year-136-recipes-that-saved-my-life_646/index.html
13 Hours: The Inside Account of What Really Happened In Benghazi,£27.06,In stock,One,https://books.toscrape.com/13-hours-the-inside-account-of-what-really-happened-in-benghazi_645/index.html
Will You Won't You Want Me?,£13.86,In stock,Three,https://books.toscrape.com/will-you-wont-you-want-me_644/index.html
Tipping Point for Planet Earth: How Close Are We to the Edge?,£37.55,In stock,One,https://books.toscrape.com/tipping-point-for-planet-earth-how-close-are-we-to-the-edge_643/index.html
The Star-Touched Queen,£32.30,In stock,Five,https://books.toscrape.com/the-star-touched-queen_642/index.html
The Silent Sister (Riley MacPherson #1),£46.29,In stock,Five,https://books.toscrape.com/the-silent-sister-riley-macpherson-1_641/index.html
The Midnight Watch: A Novel of the Titanic and the Californian,£26.20,In stock,One,https://books.toscrape.com/the-midnight-watch-a-novel-of-the-titanic-and-the-californian_640/index.html
The Lonely City: Adventures in the Art of Being Alone,£33.26,In stock,Two,https://books.toscrape.com/the-lonely-city-adventures-in-the-art-of-being-alone_639/index.html
The Gray Rhino: How to Recognize and Act on the Obvious Dangers We Ignore,£59.15,In stock,Four,https://books.toscrape.com/the-gray-rhino-how-to-recognize-and-act-on-the-obvious-dangers-we-ignore_638/index.html
The Golden Condom: And Other Essays on Love Lost and Found,£39.43,In stock,One,https://books.toscrape.com/the-golden-condom-and-other-essays-on-love-lost-and-found_637/index.html
The Epidemic (The Program 0.6),£14.44,In stock,Five,https://books.toscrape.com/the-epidemic-the-program-06_636/index.html
The Dinner Party,£56.54,In stock,Two,https://books.toscrape.com/the-dinner-party_635/index.html
The Diary of a Young Girl,£59.90,In stock,Three,https://books.toscrape.com/the-diary-of-a-young-girl_634/index.html
The Children,£11.88,In stock,Three,https://books.toscrape.com/the-children_633/index.html
Stars Above (The Lunar Chronicles #4.5),£48.05,In stock,Two,https://books.toscrape.com/stars-above-the-lunar-chronicles-45_632/index.html
Snatched: How A Drug Queen Went Undercover for the DEA and Was Kidnapped By Colombian Guerillas,£21.21,In stock,Three,https://books.toscrape.com/snatched-how-a-drug-queen-went-undercover-for-the-dea-and-was-kidnapped-by-colombian-guerillas_631/index.html
Raspberry Pi Electronics Projects for the Evil Genius,£49.67,In stock,Four,https://books.toscrape.com/raspberry-pi-electronics-projects-for-the-evil-genius_630/index.html
Quench Your Own Thirst: Business Lessons Learned Over a Beer or Two,£43.14,In stock,One,https://books.toscrape.com/quench-your-own-thirst-business-lessons-learned-over-a-beer-or-two_629/index.html
Psycho: Sanitarium (Psycho #1.5),£36.97,In stock,Five,https://books.toscrape.com/psycho-sanitarium-psycho-15_628/index.html
Poisonous (Max Revere Novels #3),£26.80,In stock,Three,https://books.toscrape.com/poisonous-max-revere-novels-3_627/index.html
One with You (Crossfire #5),£15.71,In stock,Four,https://books.toscrape.com/one-with-you-crossfire-5_626/index.html
No Love Allowed (Dodge Cove #1),£54.65,In stock,Four,https://books.toscrape.com/no-love-allowed-dodge-cove-1_625/index.html
Murder at the 42nd Street Library (Raymond Ambler #1),£54.36,In stock,Four,https://books.toscrape.com/murder-at-the-42nd-street-library-raymond-ambler-1_624/index.html
Most Wanted,£35.28,In stock,Three,https://books.toscrape.com/most-wanted_623/index.html
"Love, Lies and Spies",£20.55,In stock,Two,https://books.toscrape.com/love-lies-and-spies_622/index.html
How to Speak Golf: An Illustrated Guide to Links Lingo,£58.32,In stock,Five,https://books.toscrape.com/how-to-speak-golf-an-illustrated-guide-to-links-lingo_621/index.html
Hide Away (Eve Duncan #20),£11.84,In stock,One,https://books.toscrape.com/hide-away-eve-duncan-20_620/index.html
Furiously Happy: A Funny Book About Horrible Things,£41.46,In stock,Four,https://books.toscrape.com/furiously-happy-a-funny-book-about-horrible-things_619/index.html
Everyday Italian: 125 Simple and Delicious Recipes,£20.10,In stock,Five,https://books.toscrape.com/everyday-italian-125-simple-and-delicious-recipes_618/index.html
Equal Is Unfair: America's Misguided Fight Against Income Inequality,£56.86,In stock,One,https://books.toscrape.com/equal-is-unfair-americas-misguided-fight-against-income-inequality_617/index.html
Eleanor & Park,£56.51,In stock,Five,https://books.toscrape.com/eleanor-park_616/index.html
Dirty (Dive Bar #1),£40.83,In stock,Four,https://books.toscrape.com/dirty-dive-bar-1_615/index.html
Can You Keep a Secret? (Fear Street Relaunch #4),£48.64,In stock,One,https://books.toscrape.com/can-you-keep-a-secret-fear-street-relaunch-4_614/index.html
Boar Island (Anna Pigeon #19),£59.48,In stock,Three,https://books.toscrape.com/boar-island-anna-pigeon-19_613/index.html
A Paris Apartment,£39.01,In stock,Four,https://books.toscrape.com/a-paris-apartment_612/index.html
"A la Mode: 120 Recipes in 60 Pairings: Pies, Tarts, Cakes, Crisps, and More Topped with Ice Cream, Gelato, Frozen Custard, and More",£38.77,In stock,One,https://books.toscrape.com/a-la-mode-120-recipes-in-60-pairings-pies-tarts-cakes-crisps-and-more-topped-with-ice-cream-gelato-frozen-custard-and-more_611/index.html
Troublemaker: Surviving Hollywood and Scientology,£48.39,In stock,Two,https://books.toscrape.com/troublemaker-surviving-hollywood-and-scientology_610/index.html
The Widow,£27.26,In stock,Two,https://books.toscrape.com/the-widow_609/index.html
"The Sleep Revolution: Transforming Your Life, One Night at a Time",£11.68,In stock,Four,https://books.toscrape.com/the-sleep-revolution-transforming-your-life-one-night-at-a-time_608/index.html
The Improbability of Love,£59.45,In stock,One,https://books.toscrape.com/the-improbability-of-love_607/index.html
The Art of Startup Fundraising,£21.00,In stock,Three,https://books.toscrape.com/the-art-of-startup-fundraising_606/index.html
Take Me Home Tonight (Rock Star Romance #3),£53.98,In stock,Three,https://books.toscrape.com/take-me-home-tonight-rock-star-romance-3_605/index.html
Sleeping Giants (Themis Files #1),£48.74,In stock,One,https://books.toscrape.com/sleeping-giants-themis-files-1_604/index.html
"Setting the World on Fire: The Brief, Astonishing Life of St. Catherine of Siena",£21.15,In stock,Two,https://books.toscrape.com/setting-the-world-on-fire-the-brief-astonishing-life-of-st-catherine-of-siena_603/index.html
Playing with Fire,£13.71,In stock,Three,https://books.toscrape.com/playing-with-fire_602/index.html
Off the Hook (Fishing for Trouble #1),£47.67,In stock,Three,https://books.toscrape.com/off-the-hook-fishing-for-trouble-1_601/index.html
Mothering Sunday,£13.34,In stock,Two,https://books.toscrape.com/mothering-sunday_600/index.html
"Mother, Can You Not?",£16.89,In stock,Five,https://books.toscrape.com/mother-can-you-not_599/index.html
M Train,£27.18,In stock,One,https://books.toscrape.com/m-train_598/index.html
Lilac Girls,£17.28,In stock,Two,https://books.toscrape.com/lilac-girls_597/index.html
Lies and Other Acts of Love,£45.14,In stock,One,https://books.toscrape.com/lies-and-other-acts-of-love_596/index.html
Lab Girl,£40.85,In stock,One,https://books.toscrape.com/lab-girl_595/index.html
Keep Me Posted,£20.46,In stock,Four,https://books.toscrape.com/keep-me-posted_594/index.html
It Didn't Start with You: How Inherited Family Trauma Shapes Who We Are and How to End the Cycle,£56.27,In stock,Three,https://books.toscrape.com/it-didnt-start-with-you-how-inherited-family-trauma-shapes-who-we-are-and-how-to-end-the-cycle_593/index.html
Grey (Fifty Shades #4),£48.49,In stock,Four,https://books.toscrape.com/grey-fifty-shades-4_592/index.html
"Exit, Pursued by a Bear",£51.34,In stock,Four,https://books.toscrape.com/exit-pursued-by-a-bear_591/index.html
Daredevils,£16.34,In stock,Three,https://books.toscrape.com/daredevils_590/index.html
Cravings: Recipes for What You Want to Eat,£20.50,In stock,Three,https://books.toscrape.com/cravings-recipes-for-what-you-want-to-eat_589/index.html
Born for This: How to Find the Work You Were Meant to Do,£21.59,In stock,Five,https://books.toscrape.com/born-for-this-how-to-find-the-work-you-were-meant-to-do_588/index.html
Arena,£21.36,In stock,Four,https://books.toscrape.com/arena_587/index.html
Adultery,£20.88,In stock,Five,https://books.toscrape.com/adultery_586/index.html
A Mother's Reckoning: Living in the Aftermath of Tragedy,£19.53,In stock,Three,https://books.toscrape.com/a-mothers-reckoning-living-in-the-aftermath-of-tragedy_585/index.html
A Gentleman's Position (Society of Gentlemen #3),£14.75,In stock,Five,https://books.toscrape.com/a-gentlemans-position-society-of-gentlemen-3_584/index.html
11/22/63,£48.48,In stock,Three,https://books.toscrape.com/112263_583/index.html
"10% Happier: How I Tamed the Voice in My Head, Reduced Stress Without Losing My Edge, and Found Self-Help That Actually Works",£24.57,In stock,Two,https://books.toscrape.com/10-happier-how-i-tamed-the-voice-in-my-head-reduced-stress-without-losing-my-edge-and-found-self-help-that-actually-works_582/index.html
10-Day Green Smoothie Cleanse: Lose Up to 15 Pounds in 10 Days!,£49.71,In stock,Five,https://books.toscrape.com/10-day-green-smoothie-cleanse-lose-up-to-15-pounds-in-10-days_581/index.html
Without Shame,£48.27,In stock,Five,https://books.toscrape.com/without-shame_580/index.html
Watchmen,£58.05,In stock,Four,https://books.toscrape.com/watchmen_579/index.html
Unlimited Intuition Now,£58.87,In stock,Four,https://books.toscrape.com/unlimited-intuition-now_578/index.html
Underlying Notes,£11.82,In stock,Two,https://books.toscrape.com/underlying-notes_577/index.html
The Shack,£28.03,In stock,One,https://books.toscrape.com/the-shack_576/index.html
The New Brand You: Your New Image Makes the Sale for You,£44.05,In stock,Five,https://books.toscrape.com/the-new-brand-you-your-new-image-makes-the-sale-for-you_575/index.html
"The Moosewood Cookbook: Recipes from Moosewood Restaurant, Ithaca, New York",£12.34,In stock,Four,https://books.toscrape.com/the-moosewood-cookbook-recipes-from-moosewood-restaurant-ithaca-new-york_574/index.html
The Flowers Lied,£16.68,In stock,Two,https://books.toscrape.com/the-flowers-lied_573/index.html
"The Fabric of the Cosmos: Space, Time, and the Texture of Reality",£55.91,In stock,One,https://books.toscrape.com/the-fabric-of-the-cosmos-space-time-and-the-texture-of-reality_572/index.html
The Book of Mormon,£24.57,In stock,Three,https://books.toscrape.com/the-book-of-mormon_571/index.html
The Art and Science of Low Carbohydrate Living,£52.98,In stock,Five,https://books.toscrape.com/the-art-and-science-of-low-carbohydrate-living_570/index.html
The Alien Club,£54.40,In stock,One,https://books.toscrape.com/the-alien-club_569/index.html
Suzie Snowflake: One beautiful flake (a self-esteem story),£54.81,In stock,Five,https://books.toscrape.com/suzie-snowflake-one-beautiful-flake-a-self-esteem-story_568/index.html
Nap-a-Roo,£25.08,In stock,One,https://books.toscrape.com/nap-a-roo_567/index.html
"NaNo What Now? Finding your editing process, revising your NaNoWriMo book and building a writing career through publishing and beyond",£10.41,In stock,Four,https://books.toscrape.com/nano-what-now-finding-your-editing-process-revising-your-nanowrimo-book-and-building-a-writing-career-through-publishing-and-beyond_566/index.html
Modern Day Fables,£47.44,In stock,Two,https://books.toscrape.com/modern-day-fables_565/index.html
If I Gave You God's Phone Number....: Searching for Spirituality in America,£20.91,In stock,One,https://books.toscrape.com/if-i-gave-you-gods-phone-number-searching-for-spirituality-in-america_564/index.html
"Fruits Basket, Vol. 9 (Fruits Basket #9)",£33.95,In stock,Four,https://books.toscrape.com/fruits-basket-vol-9-fruits-basket-9_563/index.html
Dress Your Family in Corduroy and Denim,£43.68,In stock,Three,https://books.toscrape.com/dress-your-family-in-corduroy-and-denim_562/index.html
Don't Forget Steven,£33.23,In stock,One,https://books.toscrape.com/dont-forget-steven_561/index.html
Chernobyl 01:23:40: The Incredible True Story of the World's Worst Nuclear Disaster,£35.92,In stock,Two,https://books.toscrape.com/chernobyl-012340-the-incredible-true-story-of-the-worlds-worst-nuclear-disaster_560/index.html
Art and Fear: Observations on the Perils (and Rewards) of Artmaking,£48.63,In stock,Four,https://books.toscrape.com/art-and-fear-observations-on-the-perils-and-rewards-of-artmaking_559/index.html
A Shard of Ice (The Black Symphony Saga #1),£56.63,In stock,Three,https://books.toscrape.com/a-shard-of-ice-the-black-symphony-saga-1_558/index.html
A Hero's Curse (The Unseen Chronicles #1),£50.49,In stock,Three,https://books.toscrape.com/a-heros-curse-the-unseen-chronicles-1_557/index.html
23 Degrees South: A Tropical Tale of Changing Whether...,£35.79,In stock,Two,https://books.toscrape.com/23-degrees-south-a-tropical-tale-of-changing-whether_556/index.html
"Zero to One: Notes on Startups, or How to Build the Future",£34.06,In stock,Three,https://books.toscrape.com/zero-to-one-notes-on-startups-or-how-to-build-the-future_555/index.html
Why Not Me?,£17.76,In stock,One,https://books.toscrape.com/why-not-me_554/index.html
When Breath Becomes Air,£39.36,In stock,Two,https://books.toscrape.com/when-breath-becomes-air_553/index.html
Vagabonding: An Uncommon Guide to the Art of Long-Term World Travel,£36.94,In stock,Two,https://books.toscrape.com/vagabonding-an-uncommon-guide-to-the-art-of-long-term-world-travel_552/index.html
The Unlikely Pilgrimage of Harold Fry (Harold Fry #1),£43.62,In stock,Five,https://books.toscrape.com/the-unlikely-pilgrimage-of-harold-fry-harold-fry-1_551/index.html
The New Drawing on the Right Side of the Brain,£43.02,In stock,Three,https://books.toscrape.com/the-new-drawing-on-the-right-side-of-the-brain_550/index.html
"The Midnight Assassin: Panic, Scandal, and the Hunt for America's First Serial Killer",£28.45,In stock,Four,https://books.toscrape.com/the-midnight-assassin-panic-scandal-and-the-hunt-for-americas-first-serial-killer_549/index.html
The Martian (The Martian #1),£41.39,In stock,Two,https://books.toscrape.com/the-martian-the-martian-1_548/index.html
The High Mountains of Portugal,£51.15,In stock,One,https://books.toscrape.com/the-high-mountains-of-portugal_547/index.html
The Grownup,£35.88,In stock,One,https://books.toscrape.com/the-grownup_546/index.html
The E-Myth Revisited: Why Most Small Businesses Don't Work and What to Do About It,£36.91,In stock,One,https://books.toscrape.com/the-e-myth-revisited-why-most-small-businesses-dont-work-and-what-to-do-about-it_545/index.html
South of Sunshine,£28.93,In stock,One,https://books.toscrape.com/south-of-sunshine_544/index.html
Smarter Faster Better: The Secrets of Being Productive in Life and Business,£38.89,In stock,Five,https://books.toscrape.com/smarter-faster-better-the-secrets-of-being-productive-in-life-and-business_543/index.html
Silence in the Dark (Logan Point #4),£58.33,In stock,Three,https://books.toscrape.com/silence-in-the-dark-logan-point-4_542/index.html
Shadows of the Past (Logan Point #1),£39.67,In stock,Five,https://books.toscrape.com/shadows-of-the-past-logan-point-1_541/index.html
Roller Girl,£14.10,In stock,Five,https://books.toscrape.com/roller-girl_540/index.html
Rising Strong,£21.82,In stock,Three,https://books.toscrape.com/rising-strong_539/index.html
Proofs of God: Classical Arguments from Tertullian to Barth,£54.21,In stock,One,https://books.toscrape.com/proofs-of-god-classical-arguments-from-tertullian-to-barth_538/index.html
Please Kill Me: The Uncensored Oral History of Punk,£31.19,In stock,Four,https://books.toscrape.com/please-kill-me-the-uncensored-oral-history-of-punk_537/index.html
Out of Print: City Lights Spotlight No. 14,£53.64,In stock,Five,https://books.toscrape.com/out-of-print-city-lights-spotlight-no-14_536/index.html
My Life Next Door (My Life Next Door ),£36.39,In stock,Five,https://books.toscrape.com/my-life-next-door-my-life-next-door_535/index.html
Miller's Valley,£58.54,In stock,Two,https://books.toscrape.com/millers-valley_534/index.html
Man's Search for Meaning,£29.48,In stock,Three,https://books.toscrape.com/mans-search-for-meaning_533/index.html
"Love That Boy: What Two Presidents, Eight Road Trips, and My Son Taught Me About a Parent's Expectations",£25.06,In stock,Two,https://books.toscrape.com/love-that-boy-what-two-presidents-eight-road-trips-and-my-son-taught-me-about-a-parents-expectations_532/index.html
Living Forward: A Proven Plan to Stop Drifting and Get the Life You Want,£12.55,In stock,Three,https://books.toscrape.com/living-forward-a-proven-plan-to-stop-drifting-and-get-the-life-you-want_531/index.html
Les Fleurs du Mal,£29.04,In stock,Five,https://books.toscrape.com/les-fleurs-du-mal_530/index.html
Left Behind (Left Behind #1),£40.72,In stock,Two,https://books.toscrape.com/left-behind-left-behind-1_529/index.html
Kill 'Em and Leave: Searching for James Brown and the American Soul,£45.05,In stock,Five,https://books.toscrape.com/kill-em-and-leave-searching-for-james-brown-and-the-american-soul_528/index.html
Kierkegaard: A Christian Missionary to Christians,£47.13,In stock,One,https://books.toscrape.com/kierkegaard-a-christian-missionary-to-christians_527/index.html
John Vassos: Industrial Design for Modern Life,£20.22,In stock,Four,https://books.toscrape.com/john-vassos-industrial-design-for-modern-life_526/index.html
I'll Give You the Sun,£56.48,In stock,One,https://books.toscrape.com/ill-give-you-the-sun_525/index.html
I Will Find You,£44.21,In stock,One,https://books.toscrape.com/i-will-find-you_524/index.html
Hystopia: A Novel,£21.96,In stock,Four,https://books.toscrape.com/hystopia-a-novel_523/index.html
Howl and Other Poems,£40.45,In stock,Two,https://books.toscrape.com/howl-and-other-poems_522/index.html
History of Beauty,£10.29,In stock,Four,https://books.toscrape.com/history-of-beauty_521/index.html
Heaven is for Real: A Little Boy's Astounding Story of His Trip to Heaven and Back,£52.86,In stock,Two,https://books.toscrape.com/heaven-is-for-real-a-little-boys-astounding-story-of-his-trip-to-heaven-and-back_520/index.html
Future Shock (Future Shock #1),£55.65,In stock,Five,https://books.toscrape.com/future-shock-future-shock-1_519/index.html
Ender's Game (The Ender Quintet #1),£43.64,In stock,One,https://books.toscrape.com/enders-game-the-ender-quintet-1_518/index.html
Diary of a Citizen Scientist: Chasing Tiger Beetles and Other New Ways of Engaging the World,£28.41,In stock,One,https://books.toscrape.com/diary-of-a-citizen-scientist-chasing-tiger-beetles-and-other-new-ways-of-engaging-the-world_517/index.html
Death by Leisure: A Cautionary Tale,£37.51,In stock,Four,https://books.toscrape.com/death-by-leisure-a-cautionary-tale_516/index.html
Brilliant Beacons: A History of the American Lighthouse,£11.45,In stock,Three,https://books.toscrape.com/brilliant-beacons-a-history-of-the-american-lighthouse_515/index.html
Brazen: The Courage to Find the You That's Been Hiding,£19.22,In stock,Two,https://books.toscrape.com/brazen-the-courage-to-find-the-you-thats-been-hiding_514/index.html
Between the World and Me,£56.91,In stock,Four,https://books.toscrape.com/between-the-world-and-me_513/index.html
Being Mortal: Medicine and What Matters in the End,£55.06,In stock,Four,https://books.toscrape.com/being-mortal-medicine-and-what-matters-in-the-end_512/index.html
"A Murder Over a Girl: Justice, Gender, Junior High",£13.20,In stock,Three,https://books.toscrape.com/a-murder-over-a-girl-justice-gender-junior-high_511/index.html
32 Yolks,£53.63,In stock,Two,https://books.toscrape.com/32-yolks_510/index.html
"""Most Blessed of the Patriarchs"": Thomas Jefferson and the Empire of the Imagination",£44.48,In stock,Five,https://books.toscrape.com/most-blessed-of-the-patriarchs-thomas-jefferson-and-the-empire-of-the-imagination_509/index.html
You Are a Badass: How to Stop Doubting Your Greatness and Start Living an Awesome Life,£12.08,In stock,Three,https://books.toscrape.com/you-are-a-badass-how-to-stop-doubting-your-greatness-and-start-living-an-awesome-life_508/index.html
Wildlife of New York: A Five-Borough Coloring Book,£22.14,In stock,Two,https://books.toscrape.com/wildlife-of-new-york-a-five-borough-coloring-book_507/index.html
What Happened on Beale Street (Secrets of the South Mysteries #2),£25.37,In stock,Five,https://books.toscrape.com/what-happened-on-beale-street-secrets-of-the-south-mysteries-2_506/index.html
Unreasonable Hope: Finding Faith in the God Who Brings Purpose to Your Pain,£46.33,In stock,Two,https://books.toscrape.com/unreasonable-hope-finding-faith-in-the-god-who-brings-purpose-to-your-pain_505/index.html
Under the Tuscan Sun,£37.33,In stock,Three,https://books.toscrape.com/under-the-tuscan-sun_504/index.html
Toddlers Are A**holes: It's Not Your Fault,£25.55,In stock,One,https://books.toscrape.com/toddlers-are-aholes-its-not-your-fault_503/index.html
The Year of Living Biblically: One Man's Humble Quest to Follow the Bible as Literally as Possible,£34.72,In stock,One,https://books.toscrape.com/the-year-of-living-biblically-one-mans-humble-quest-to-follow-the-bible-as-literally-as-possible_502/index.html
The Whale,£35.96,In stock,Four,https://books.toscrape.com/the-whale_501/index.html
The Story of Art,£41.14,In stock,Four,https://books.toscrape.com/the-story-of-art_500/index.html
The Origin of Species,£10.01,In stock,Four,https://books.toscrape.com/the-origin-of-species_499/index.html
The Great Gatsby,£36.05,In stock,Four,https://books.toscrape.com/the-great-gatsby_498/index.html
The Good Girl,£49.03,In stock,Three,https://books.toscrape.com/the-good-girl_497/index.html
The Glass Castle,£16.24,In stock,One,https://books.toscrape.com/the-glass-castle_496/index.html
The Faith of Christopher Hitchens: The Restless Soul of the World's Most Notorious Atheist,£39.55,In stock,One,https://books.toscrape.com/the-faith-of-christopher-hitchens-the-restless-soul-of-the-worlds-most-notorious-atheist_495/index.html
The Drowning Girls,£35.67,In stock,Three,https://books.toscrape.com/the-drowning-girls_494/index.html
The Constant Princess (The Tudor Court #1),£16.62,In stock,Three,https://books.toscrape.com/the-constant-princess-the-tudor-court-1_493/index.html
The Bourne Identity (Jason Bourne #1),£42.78,In stock,Four,https://books.toscrape.com/the-bourne-identity-jason-bourne-1_492/index.html
The Bachelor Girl's Guide to Murder (Herringford and Watts Mysteries #1),£52.30,In stock,Five,https://books.toscrape.com/the-bachelor-girls-guide-to-murder-herringford-and-watts-mysteries-1_491/index.html
The Art Book,£32.34,In stock,Two,https://books.toscrape.com/the-art-book_490/index.html
The 7 Habits of Highly Effective People: Powerful Lessons in Personal Change,£33.17,In stock,Four,https://books.toscrape.com/the-7-habits-of-highly-effective-people-powerful-lessons-in-personal-change_489/index.html
Team of Rivals: The Political Genius of Abraham Lincoln,£20.12,In stock,Five,https://books.toscrape.com/team-of-rivals-the-political-genius-of-abraham-lincoln_488/index.html
Steal Like an Artist: 10 Things Nobody Told You About Being Creative,£20.90,In stock,Two,https://books.toscrape.com/steal-like-an-artist-10-things-nobody-told-you-about-being-creative_487/index.html
"Sit, Stay, Love",£20.90,In stock,Three,https://books.toscrape.com/sit-stay-love_486/index.html
Sister Dear,£40.20,In stock,Four,https://books.toscrape.com/sister-dear_485/index.html
"Shrunken Treasures: Literary Classics, Short, Sweet, and Silly",£52.87,In stock,Three,https://books.toscrape.com/shrunken-treasures-literary-classics-short-sweet-and-silly_484/index.html
"Rich Dad, Poor Dad",£51.74,In stock,One,https://books.toscrape.com/rich-dad-poor-dad_483/index.html
Raymie Nightingale,£34.41,In stock,Two,https://books.toscrape.com/raymie-nightingale_482/index.html
Playing from the Heart,£32.38,In stock,One,https://books.toscrape.com/playing-from-the-heart_481/index.html
Nightstruck: A Novel,£50.35,In stock,Four,https://books.toscrape.com/nightstruck-a-novel_480/index.html
"Naturally Lean: 125 Nourishing Gluten-Free, Plant-Based Recipes--All Under 300 Calories",£11.38,In stock,Five,https://books.toscrape.com/naturally-lean-125-nourishing-gluten-free-plant-based-recipes-all-under-300-calories_479/index.html
Meternity,£43.58,In stock,Three,https://books.toscrape.com/meternity_478/index.html
Memoirs of a Geisha,£49.67,In stock,Three,https://books.toscrape.com/memoirs-of-a-geisha_477/index.html
Like Never Before (Walker Family #2),£28.77,In stock,Two,https://books.toscrape.com/like-never-before-walker-family-2_476/index.html
Life of Pi,£13.22,In stock,Four,https://books.toscrape.com/life-of-pi_475/index.html
