title,price,availability,rating,link
Suddenly in Love (Lake Haven #1),£55.99,In stock,Two,https://books.toscrape.com/suddenly-in-love-lake-haven-1_835/index.html
Something More Than This,£16.24,In stock,Four,https://books.toscrape.com/something-more-than-this_834/index.html
Soft Apocalypse,£26.12,In stock,Two,https://books.toscrape.com/soft-apocalypse_833/index.html
So You've Been Publicly Shamed,£12.23,In stock,Two,https://books.toscrape.com/so-youve-been-publicly-shamed_832/index.html
Shoe Dog: A Memoir by the Creator of NIKE,£23.99,In stock,Two,https://books.toscrape.com/shoe-dog-a-memoir-by-the-creator-of-nike_831/index.html
"Shobu Samurai, Project Aryoku (#3)",£29.06,In stock,Three,https://books.toscrape.com/shobu-samurai-project-aryoku-3_830/index.html
Secrets and Lace (Fatal Hearts #1),£20.27,In stock,One,https://books.toscrape.com/secrets-and-lace-fatal-hearts-1_829/index.html
Scarlett Epstein Hates It Here,£43.55,In stock,Five,https://books.toscrape.com/scarlett-epstein-hates-it-here_828/index.html
Romero and Juliet: A Tragic Tale of Love and Zombies,£36.94,In stock,One,https://books.toscrape.com/romero-and-juliet-a-tragic-tale-of-love-and-zombies_827/index.html
Redeeming Love,£20.47,In stock,Five,https://books.toscrape.com/redeeming-love_826/index.html
Poses for Artists Volume 1 - Dynamic and Sitting Poses: An Essential Reference for Figure Drawing and the Human Form,£41.06,In stock,One,https://books.toscrape.com/poses-for-artists-volume-1-dynamic-and-sitting-poses-an-essential-reference-for-figure-drawing-and-the-human-form_825/index.html
Poems That Make Grown Women Cry,£14.19,In stock,Four,https://books.toscrape.com/poems-that-make-grown-women-cry_824/index.html
"Nightingale, Sing",£38.28,In stock,One,https://books.toscrape.com/nightingale-sing_823/index.html
Night Sky with Exit Wounds,£41.05,In stock,One,https://books.toscrape.com/night-sky-with-exit-wounds_822/index.html
Mrs. Houdini,£30.25,In stock,Five,https://books.toscrape.com/mrs-houdini_821/index.html
Modern Romance,£28.26,In stock,Five,https://books.toscrape.com/modern-romance_820/index.html
Miss Peregrine’s Home for Peculiar Children (Miss Peregrine’s Peculiar Children #1),£10.76,In stock,One,https://books.toscrape.com/miss-peregrines-home-for-peculiar-children-miss-peregrines-peculiar-children-1_819/index.html
Louisa: The Extraordinary Life of Mrs. Adams,£16.85,In stock,Two,https://books.toscrape.com/louisa-the-extraordinary-life-of-mrs-adams_818/index.html
Little Red,£13.47,In stock,Three,https://books.toscrape.com/little-red_817/index.html
Library of Souls (Miss Peregrine’s Peculiar Children #3),£48.56,In stock,Five,https://books.toscrape.com/library-of-souls-miss-peregrines-peculiar-children-3_816/index.html
Large Print Heart of the Pride,£19.15,In stock,Two,https://books.toscrape.com/large-print-heart-of-the-pride_815/index.html
I Had a Nice Time And Other Lies...: How to find love & sh*t like that,£57.36,In stock,Four,https://books.toscrape.com/i-had-a-nice-time-and-other-lies-how-to-find-love-sht-like-that_814/index.html
Hollow City (Miss Peregrine’s Peculiar Children #2),£42.98,In stock,One,https://books.toscrape.com/hollow-city-miss-peregrines-peculiar-children-2_813/index.html
Grumbles,£22.16,In stock,Two,https://books.toscrape.com/grumbles_812/index.html
Full Moon over Noah’s Ark: An Odyssey to Mount Ararat and Beyond,£49.43,In stock,Four,https://books.toscrape.com/full-moon-over-noahs-ark-an-odyssey-to-mount-ararat-and-beyond_811/index.html
Frostbite (Vampire Academy #2),£29.99,In stock,Five,https://books.toscrape.com/frostbite-vampire-academy-2_810/index.html
Follow You Home,£21.36,In stock,One,https://books.toscrape.com/follow-you-home_809/index.html
First Steps for New Christians (Print Edition),£29.00,In stock,One,https://books.toscrape.com/first-steps-for-new-christians-print-edition_808/index.html
Finders Keepers (Bill Hodges Trilogy #2),£53.53,In stock,Five,https://books.toscrape.com/finders-keepers-bill-hodges-trilogy-2_807/index.html
"Fables, Vol. 1: Legends in Exile (Fables #1)",£41.62,In stock,Four,https://books.toscrape.com/fables-vol-1-legends-in-exile-fables-1_806/index.html
Eureka Trivia 6.0,£54.59,In stock,Four,https://books.toscrape.com/eureka-trivia-60_805/index.html
Drive: The Surprising Truth About What Motivates Us,£34.95,In stock,Four,https://books.toscrape.com/drive-the-surprising-truth-about-what-motivates-us_804/index.html
Done Rubbed Out (Reightman & Bailey #1),£37.72,In stock,Five,https://books.toscrape.com/done-rubbed-out-reightman-bailey-1_803/index.html
Doing It Over (Most Likely To #1),£35.61,In stock,Three,https://books.toscrape.com/doing-it-over-most-likely-to-1_802/index.html
"Deliciously Ella Every Day: Quick and Easy Recipes for Gluten-Free Snacks, Packed Lunches, and Simple Meals",£42.16,In stock,Three,https://books.toscrape.com/deliciously-ella-every-day-quick-and-easy-recipes-for-gluten-free-snacks-packed-lunches-and-simple-meals_801/index.html
Dark Notes,£19.19,In stock,Five,https://books.toscrape.com/dark-notes_800/index.html
"Daring Greatly: How the Courage to Be Vulnerable Transforms the Way We Live, Love, Parent, and Lead",£19.43,In stock,Three,https://books.toscrape.com/daring-greatly-how-the-courage-to-be-vulnerable-transforms-the-way-we-live-love-parent-and-lead_799/index.html
Close to You,£49.46,In stock,Four,https://books.toscrape.com/close-to-you_798/index.html
Chasing Heaven: What Dying Taught Me About Living,£37.80,In stock,Two,https://books.toscrape.com/chasing-heaven-what-dying-taught-me-about-living_797/index.html
Big Magic: Creative Living Beyond Fear,£30.80,In stock,Three,https://books.toscrape.com/big-magic-creative-living-beyond-fear_796/index.html
Becoming Wise: An Inquiry into the Mystery and Art of Living,£27.43,In stock,Two,https://books.toscrape.com/becoming-wise-an-inquiry-into-the-mystery-and-art-of-living_795/index.html
Beauty Restored (Riley Family Legacy Novellas #3),£11.11,In stock,Two,https://books.toscrape.com/beauty-restored-riley-family-legacy-novellas-3_794/index.html
Batman: The Long Halloween (Batman),£36.50,In stock,Two,https://books.toscrape.com/batman-the-long-halloween-batman_793/index.html
Batman: The Dark Knight Returns (Batman),£15.38,In stock,Five,https://books.toscrape.com/batman-the-dark-knight-returns-batman_792/index.html
Ayumi's Violin,£15.48,In stock,Two,https://books.toscrape.com/ayumis-violin_791/index.html
Anonymous,£46.82,In stock,Four,https://books.toscrape.com/anonymous_790/index.html
Amy Meets the Saints and Sages,£18.46,In stock,Three,https://books.toscrape.com/amy-meets-the-saints-and-sages_789/index.html
Amid the Chaos,£36.58,In stock,One,https://books.toscrape.com/amid-the-chaos_788/index.html
Amatus,£50.54,In stock,Five,https://books.toscrape.com/amatus_787/index.html
Agnostic: A Spirited Manifesto,£12.51,In stock,Five,https://books.toscrape.com/agnostic-a-spirited-manifesto_786/index.html
Zealot: The Life and Times of Jesus of Nazareth,£24.70,In stock,Three,https://books.toscrape.com/zealot-the-life-and-times-of-jesus-of-nazareth_785/index.html
You (You #1),£43.61,In stock,Five,https://books.toscrape.com/you-you-1_784/index.html
"Wonder Woman: Earth One, Volume One (Wonder Woman: Earth One #1)",£37.34,In stock,Four,https://books.toscrape.com/wonder-woman-earth-one-volume-one-wonder-woman-earth-one-1_783/index.html
Wild Swans,£14.36,In stock,Two,https://books.toscrape.com/wild-swans_782/index.html
Why the Right Went Wrong: Conservatism--From Goldwater to the Tea Party and Beyond,£52.65,In stock,Four,https://books.toscrape.com/why-the-right-went-wrong-conservatism-from-goldwater-to-the-tea-party-and-beyond_781/index.html
Whole Lotta Creativity Going On: 60 Fun and Unusual Exercises to Awaken and Strengthen Your Creativity,£38.20,In stock,Four,https://books.toscrape.com/whole-lotta-creativity-going-on-60-fun-and-unusual-exercises-to-awaken-and-strengthen-your-creativity_780/index.html
What's It Like in Space?: Stories from Astronauts Who've Been There,£19.60,In stock,Two,https://books.toscrape.com/whats-it-like-in-space-stories-from-astronauts-whove-been-there_779/index.html
"We Are Robin, Vol. 1: The Vigilante Business (We Are Robin #1)",£53.90,In stock,One,https://books.toscrape.com/we-are-robin-vol-1-the-vigilante-business-we-are-robin-1_778/index.html
Walt Disney's Alice in Wonderland,£12.96,In stock,Five,https://books.toscrape.com/walt-disneys-alice-in-wonderland_777/index.html
V for Vendetta (V for Vendetta Complete),£37.10,In stock,Four,https://books.toscrape.com/v-for-vendetta-v-for-vendetta-complete_776/index.html
Until Friday Night (The Field Party #1),£46.31,In stock,Two,https://books.toscrape.com/until-friday-night-the-field-party-1_775/index.html
"Unbroken: A World War II Story of Survival, Resilience, and Redemption",£45.95,In stock,Two,https://books.toscrape.com/unbroken-a-world-war-ii-story-of-survival-resilience-and-redemption_774/index.html
Twenty Yawns,£22.08,In stock,Two,https://books.toscrape.com/twenty-yawns_773/index.html
Through the Woods,£25.38,In stock,Two,https://books.toscrape.com/through-the-woods_772/index.html
This Is Where It Ends,£27.12,In stock,Two,https://books.toscrape.com/this-is-where-it-ends_771/index.html
The Year of Magical Thinking,£43.04,In stock,Two,https://books.toscrape.com/the-year-of-magical-thinking_770/index.html
The Wright Brothers,£56.80,In stock,Four,https://books.toscrape.com/the-wright-brothers_769/index.html
The White Queen (The Cousins' War #1),£25.91,In stock,Five,https://books.toscrape.com/the-white-queen-the-cousins-war-1_768/index.html
The Wedding Pact (The O'Malleys #2),£32.61,In stock,Three,https://books.toscrape.com/the-wedding-pact-the-omalleys-2_767/index.html
The Time Keeper,£27.88,In stock,Five,https://books.toscrape.com/the-time-keeper_766/index.html
The Testament of Mary,£52.67,In stock,Four,https://books.toscrape.com/the-testament-of-mary_765/index.html
The Star-Touched Queen,£46.02,In stock,Five,https://books.toscrape.com/the-star-touched-queen_764/index.html
The Songs of the Gods,£44.48,In stock,Five,https://books.toscrape.com/the-songs-of-the-gods_763/index.html
The Song of Achilles,£37.40,In stock,Five,https://books.toscrape.com/the-song-of-achilles_762/index.html
The Rosie Project (Don Tillman #1),£54.04,In stock,One,https://books.toscrape.com/the-rosie-project-don-tillman-1_761/index.html
The Power of Habit: Why We Do What We Do in Life and Business,£16.88,In stock,Three,https://books.toscrape.com/the-power-of-habit-why-we-do-what-we-do-in-life-and-business_760/index.html
The Marriage of Opposites,£28.08,In stock,Four,https://books.toscrape.com/the-marriage-of-opposites_759/index.html
The Lucifer Effect: Understanding How Good People Turn Evil,£10.40,In stock,One,https://books.toscrape.com/the-lucifer-effect-understanding-how-good-people-turn-evil_758/index.html
The Long Haul (Diary of a Wimpy Kid #9),£44.07,In stock,One,https://books.toscrape.com/the-long-haul-diary-of-a-wimpy-kid-9_757/index.html
The Loney,£23.40,In stock,One,https://books.toscrape.com/the-loney_756/index.html
The Literature Book (Big Ideas Simply Explained),£17.43,In stock,Three,https://books.toscrape.com/the-literature-book-big-ideas-simply-explained_755/index.html
The Last Mile (Amos Decker #2),£54.21,In stock,Two,https://books.toscrape.com/the-last-mile-amos-decker-2_754/index.html
The Immortal Life of Henrietta Lacks,£40.67,In stock,Two,https://books.toscrape.com/the-immortal-life-of-henrietta-lacks_753/index.html
The Hidden Oracle (The Trials of Apollo #1),£52.26,In stock,Two,https://books.toscrape.com/the-hidden-oracle-the-trials-of-apollo-1_752/index.html
The Help Yourself Cookbook for Kids: 60 Easy Plant-Based Recipes Kids Can Make to Stay Healthy and Save the Earth,£28.77,In stock,Three,https://books.toscrape.com/the-help-yourself-cookbook-for-kids-60-easy-plant-based-recipes-kids-can-make-to-stay-healthy-and-save-the-earth_751/index.html
The Guilty (Will Robie #4),£13.82,In stock,Two,https://books.toscrape.com/the-guilty-will-robie-4_750/index.html
The First Hostage (J.B. Collins #2),£25.85,In stock,Three,https://books.toscrape.com/the-first-hostage-jb-collins-2_749/index.html
The Dovekeepers,£48.78,In stock,One,https://books.toscrape.com/the-dovekeepers_748/index.html
The Darkest Lie,£35.35,In stock,Five,https://books.toscrape.com/the-darkest-lie_747/index.html
The Bane Chronicles (The Bane Chronicles #1-11),£44.73,In stock,Four,https://books.toscrape.com/the-bane-chronicles-the-bane-chronicles-1-11_746/index.html
The Bad-Ass Librarians of Timbuktu: And Their Race to Save the World’s Most Precious Manuscripts,£15.77,In stock,One,https://books.toscrape.com/the-bad-ass-librarians-of-timbuktu-and-their-race-to-save-the-worlds-most-precious-manuscripts_745/index.html
The 14th Colony (Cotton Malone #11),£39.24,In stock,One,https://books.toscrape.com/the-14th-colony-cotton-malone-11_744/index.html
That Darkness (Gardiner and Renner #1),£13.92,In stock,One,https://books.toscrape.com/that-darkness-gardiner-and-renner-1_743/index.html
Tastes Like Fear (DI Marnie Rome #3),£10.69,In stock,One,https://books.toscrape.com/tastes-like-fear-di-marnie-rome-3_742/index.html
Take Me with You,£45.21,In stock,Three,https://books.toscrape.com/take-me-with-you_741/index.html
Swell: A Year of Waves,£45.58,In stock,One,https://books.toscrape.com/swell-a-year-of-waves_740/index.html
Superman Vol. 1: Before Truth (Superman by Gene Luen Yang #1),£11.89,In stock,Five,https://books.toscrape.com/superman-vol-1-before-truth-superman-by-gene-luen-yang-1_739/index.html
Still Life with Bread Crumbs,£26.41,In stock,Three,https://books.toscrape.com/still-life-with-bread-crumbs_738/index.html
Steve Jobs,£39.50,In stock,Five,https://books.toscrape.com/steve-jobs_737/index.html
Sorting the Beef from the Bull: The Science of Food Fraud Forensics,£44.74,In stock,Four,https://books.toscrape.com/sorting-the-beef-from-the-bull-the-science-of-food-fraud-forensics_736/index.html
Someone Like You (The Harrisons #2),£52.79,In stock,Five,https://books.toscrape.com/someone-like-you-the-harrisons-2_735/index.html
"So Cute It Hurts!!, Vol. 6 (So Cute It Hurts!! #6)",£35.43,In stock,Four,https://books.toscrape.com/so-cute-it-hurts-vol-6-so-cute-it-hurts-6_734/index.html
Shtum,£55.84,In stock,Four,https://books.toscrape.com/shtum_733/index.html
See America: A Celebration of Our National Parks & Treasured Sites,£48.87,In stock,Three,https://books.toscrape.com/see-america-a-celebration-of-our-national-parks-treasured-sites_732/index.html
salt.,£46.78,In stock,Four,https://books.toscrape.com/salt_731/index.html
Robin War,£47.82,In stock,Three,https://books.toscrape.com/robin-war_730/index.html
"Red Hood/Arsenal, Vol. 1: Open for Business (Red Hood/Arsenal #1)",£25.48,In stock,Two,https://books.toscrape.com/red-hoodarsenal-vol-1-open-for-business-red-hoodarsenal-1_729/index.html
Rain Fish,£23.57,In stock,Three,https://books.toscrape.com/rain-fish_728/index.html
"Quarter Life Poetry: Poems for the Young, Broke and Hangry",£50.89,In stock,Five,https://books.toscrape.com/quarter-life-poetry-poems-for-the-young-broke-and-hangry_727/index.html
Pet Sematary,£10.56,In stock,Three,https://books.toscrape.com/pet-sematary_726/index.html
"Overload: How to Unplug, Unwind, and Unleash Yourself from the Pressure of Stress",£52.15,In stock,Three,https://books.toscrape.com/overload-how-to-unplug-unwind-and-unleash-yourself-from-the-pressure-of-stress_725/index.html
Once Was a Time,£18.28,In stock,Two,https://books.toscrape.com/once-was-a-time_724/index.html
Old School (Diary of a Wimpy Kid #10),£11.83,In stock,Five,https://books.toscrape.com/old-school-diary-of-a-wimpy-kid-10_723/index.html
No Dream Is Too High: Life Lessons From a Man Who Walked on the Moon,£21.95,In stock,Two,https://books.toscrape.com/no-dream-is-too-high-life-lessons-from-a-man-who-walked-on-the-moon_722/index.html
"Naruto (3-in-1 Edition), Vol. 14: Includes Vols. 40, 41 & 42 (Naruto: Omnibus #14)",£38.39,In stock,Two,https://books.toscrape.com/naruto-3-in-1-edition-vol-14-includes-vols-40-41-42-naruto-omnibus-14_721/index.html
My Name Is Lucy Barton,£41.56,In stock,One,https://books.toscrape.com/my-name-is-lucy-barton_720/index.html
My Mrs. Brown,£24.48,In stock,Three,https://books.toscrape.com/my-mrs-brown_719/index.html
My Kind of Crazy,£40.36,In stock,One,https://books.toscrape.com/my-kind-of-crazy_718/index.html
Mr. Mercedes (Bill Hodges Trilogy #1),£28.90,In stock,One,https://books.toscrape.com/mr-mercedes-bill-hodges-trilogy-1_717/index.html
More Than Music (Chasing the Dream #1),£37.61,In stock,Two,https://books.toscrape.com/more-than-music-chasing-the-dream-1_716/index.html
Made to Stick: Why Some Ideas Survive and Others Die,£38.85,In stock,Five,https://books.toscrape.com/made-to-stick-why-some-ideas-survive-and-others-die_715/index.html
Luis Paints the World,£53.95,In stock,Three,https://books.toscrape.com/luis-paints-the-world_714/index.html
Luckiest Girl Alive,£49.83,In stock,Three,https://books.toscrape.com/luckiest-girl-alive_713/index.html
Lowriders to the Center of the Earth (Lowriders in Space #2),£51.51,In stock,Two,https://books.toscrape.com/lowriders-to-the-center-of-the-earth-lowriders-in-space-2_712/index.html
Love Is a Mix Tape (Music #1),£18.03,In stock,One,https://books.toscrape.com/love-is-a-mix-tape-music-1_711/index.html
Looking for Lovely: Collecting the Moments that Matter,£29.14,In stock,Five,https://books.toscrape.com/looking-for-lovely-collecting-the-moments-that-matter_710/index.html
"Living Leadership by Insight: A Good Leader Achieves, a Great Leader Builds Monuments",£46.91,In stock,Four,https://books.toscrape.com/living-leadership-by-insight-a-good-leader-achieves-a-great-leader-builds-monuments_709/index.html
Let It Out: A Journey Through Journaling,£26.79,In stock,Five,https://books.toscrape.com/let-it-out-a-journey-through-journaling_708/index.html
Lady Midnight (The Dark Artifices #1),£16.28,In stock,Five,https://books.toscrape.com/lady-midnight-the-dark-artifices-1_707/index.html
"It's All Easy: Healthy, Delicious Weeknight Meals in under 30 Minutes",£19.55,In stock,One,https://books.toscrape.com/its-all-easy-healthy-delicious-weeknight-meals-in-under-30-minutes_706/index.html
Island of Dragons (Unwanteds #7),£29.65,In stock,One,https://books.toscrape.com/island-of-dragons-unwanteds-7_705/index.html
I Know What I'm Doing -- and Other Lies I Tell Myself: Dispatches from a Life Under Construction,£25.98,In stock,Four,https://books.toscrape.com/i-know-what-im-doing-and-other-lies-i-tell-myself-dispatches-from-a-life-under-construction_704/index.html
I Am Pilgrim (Pilgrim #1),£10.60,In stock,Four,https://books.toscrape.com/i-am-pilgrim-pilgrim-1_703/index.html
"Hyperbole and a Half: Unfortunate Situations, Flawed Coping Mechanisms, Mayhem, and Other Things That Happened",£14.75,In stock,Five,https://books.toscrape.com/hyperbole-and-a-half-unfortunate-situations-flawed-coping-mechanisms-mayhem-and-other-things-that-happened_702/index.html
"Hush, Hush (Hush, Hush #1)",£47.02,In stock,Three,https://books.toscrape.com/hush-hush-hush-hush-1_701/index.html
Hold Your Breath (Search and Rescue #1),£28.82,In stock,One,https://books.toscrape.com/hold-your-breath-search-and-rescue-1_700/index.html
Hamilton: The Revolution,£58.79,In stock,Three,https://books.toscrape.com/hamilton-the-revolution_699/index.html
Greek Mythic History,£10.23,In stock,Five,https://books.toscrape.com/greek-mythic-history_698/index.html
God: The Most Unpleasant Character in All Fiction,£30.03,In stock,Five,https://books.toscrape.com/god-the-most-unpleasant-character-in-all-fiction_697/index.html
Glory over Everything: Beyond The Kitchen House,£45.84,In stock,Three,https://books.toscrape.com/glory-over-everything-beyond-the-kitchen-house_696/index.html
Feathers: Displays of Brilliant Plumage,£49.05,In stock,Three,https://books.toscrape.com/feathers-displays-of-brilliant-plumage_695/index.html
"Far & Away: Places on the Brink of Change: Seven Continents, Twenty-Five Years",£15.06,In stock,Four,https://books.toscrape.com/far-away-places-on-the-brink-of-change-seven-continents-twenty-five-years_694/index.html
Every Last Word,£46.47,In stock,Three,https://books.toscrape.com/every-last-word_693/index.html
Eligible (The Austen Project #4),£27.09,In stock,Three,https://books.toscrape.com/eligible-the-austen-project-4_692/index.html
El Deafo,£57.62,In stock,Five,https://books.toscrape.com/el-deafo_691/index.html
Eight Hundred Grapes,£14.39,In stock,Four,https://books.toscrape.com/eight-hundred-grapes_690/index.html
"Eaternity: More than 150 Deliciously Easy Vegan Recipes for a Long, Healthy, Satisfied, Joyful Life",£51.75,In stock,Five,https://books.toscrape.com/eaternity-more-than-150-deliciously-easy-vegan-recipes-for-a-long-healthy-satisfied-joyful-life_689/index.html
"Eat Fat, Get Thin",£54.07,In stock,Two,https://books.toscrape.com/eat-fat-get-thin_688/index.html
Don't Get Caught,£55.35,In stock,One,https://books.toscrape.com/dont-get-caught_687/index.html
Doctor Sleep (The Shining #2),£40.12,In stock,Two,https://books.toscrape.com/doctor-sleep-the-shining-2_686/index.html
Demigods & Magicians: Percy and Annabeth Meet the Kanes (Percy Jackson & Kane Chronicles Crossover #1-3),£37.51,In stock,Five,https://books.toscrape.com/demigods-magicians-percy-and-annabeth-meet-the-kanes-percy-jackson-kane-chronicles-crossover-1-3_685/index.html
Dear Mr. Knightley,£11.21,In stock,Five,https://books.toscrape.com/dear-mr-knightley_684/index.html
Daily Fantasy Sports,£36.58,In stock,One,https://books.toscrape.com/daily-fantasy-sports_683/index.html
Crazy Love: Overwhelmed by a Relentless God,£47.72,In stock,Two,https://books.toscrape.com/crazy-love-overwhelmed-by-a-relentless-god_682/index.html
Cometh the Hour (The Clifton Chronicles #6),£25.01,In stock,Three,https://books.toscrape.com/cometh-the-hour-the-clifton-chronicles-6_681/index.html
Code Name Verity (Code Name Verity #1),£22.13,In stock,Four,https://books.toscrape.com/code-name-verity-code-name-verity-1_680/index.html
Clockwork Angel (The Infernal Devices #1),£44.14,In stock,One,https://books.toscrape.com/clockwork-angel-the-infernal-devices-1_679/index.html
City of Glass (The Mortal Instruments #3),£56.02,In stock,Four,https://books.toscrape.com/city-of-glass-the-mortal-instruments-3_678/index.html
City of Fallen Angels (The Mortal Instruments #4),£11.23,In stock,Four,https://books.toscrape.com/city-of-fallen-angels-the-mortal-instruments-4_677/index.html
City of Bones (The Mortal Instruments #1),£43.28,In stock,One,https://books.toscrape.com/city-of-bones-the-mortal-instruments-1_676/index.html
City of Ashes (The Mortal Instruments #2),£47.27,In stock,One,https://books.toscrape.com/city-of-ashes-the-mortal-instruments-2_675/index.html
Cell,£20.29,In stock,Four,https://books.toscrape.com/cell_674/index.html
Catching Jordan (Hundred Oaks),£50.83,In stock,Three,https://books.toscrape.com/catching-jordan-hundred-oaks_673/index.html
"Carry On, Warrior: Thoughts on Life Unarmed",£31.85,In stock,Three,https://books.toscrape.com/carry-on-warrior-thoughts-on-life-unarmed_672/index.html
Carrie,£46.23,In stock,Two,https://books.toscrape.com/carrie_671/index.html
Buying In: The Secret Dialogue Between What We Buy and Who We Are,£37.80,In stock,Four,https://books.toscrape.com/buying-in-the-secret-dialogue-between-what-we-buy-and-who-we-are_670/index.html
Brain on Fire: My Month of Madness,£49.32,In stock,Five,https://books.toscrape.com/brain-on-fire-my-month-of-madness_669/index.html
Batman: Europa,£32.01,In stock,Two,https://books.toscrape.com/batman-europa_668/index.html
Barefoot Contessa Back to Basics,£28.01,In stock,One,https://books.toscrape.com/barefoot-contessa-back-to-basics_667/index.html
Barefoot Contessa at Home: Everyday Recipes You'll Make Over and Over Again,£50.62,In stock,Five,https://books.toscrape.com/barefoot-contessa-at-home-everyday-recipes-youll-make-over-and-over-again_666/index.html
Balloon Animals,£17.03,In stock,Three,https://books.toscrape.com/balloon-animals_665/index.html
Art Ops Vol. 1,£48.80,In stock,Three,https://books.toscrape.com/art-ops-vol-1_664/index.html
Aristotle and Dante Discover the Secrets of the Universe (Aristotle and Dante Discover the Secrets of the Universe #1),£58.14,In stock,Four,https://books.toscrape.com/aristotle-and-dante-discover-the-secrets-of-the-universe-aristotle-and-dante-discover-the-secrets-of-the-universe-1_663/index.html
Angels Walking (Angels Walking #1),£34.20,In stock,Two,https://books.toscrape.com/angels-walking-angels-walking-1_662/index.html
Angels & Demons (Robert Langdon #1),£51.48,In stock,Three,https://books.toscrape.com/angels-demons-robert-langdon-1_661/index.html
All the Light We Cannot See,£29.87,In stock,Five,https://books.toscrape.com/all-the-light-we-cannot-see_660/index.html
"Adulthood Is a Myth: A ""Sarah's Scribbles"" Collection",£10.90,In stock,Two,https://books.toscrape.com/adulthood-is-a-myth-a-sarahs-scribbles-collection_659/index.html
Abstract City,£56.37,In stock,Five,https://books.toscrape.com/abstract-city_658/index.html
A Time of Torment (Charlie Parker #14),£48.35,In stock,Five,https://books.toscrape.com/a-time-of-torment-charlie-parker-14_657/index.html
A Study in Scarlet (Sherlock Holmes #1),£16.73,In stock,Two,https://books.toscrape.com/a-study-in-scarlet-sherlock-holmes-1_656/index.html
"A Series of Catastrophes and Miracles: A True Story of Love, Science, and Cancer",£56.48,In stock,Two,https://books.toscrape.com/a-series-of-catastrophes-and-miracles-a-true-story-of-love-science-and-cancer_655/index.html
A People's History of the United States,£40.79,In stock,Two,https://books.toscrape.com/a-peoples-history-of-the-united-states_654/index.html
A Man Called Ove,£39.72,In stock,One,https://books.toscrape.com/a-man-called-ove_653/index.html
