title,price,availability,rating,link
Twenties Girl,£42.80,In stock,Two,https://books.toscrape.com/twenties-girl_292/index.html
"Trespassing Across America: One Man's Epic, Never-Done-Before (and Sort of Illegal) Hike Across the Heartland",£53.51,In stock,One,https://books.toscrape.com/trespassing-across-america-one-mans-epic-never-done-before-and-sort-of-illegal-hike-across-the-heartland_291/index.html
Three-Martini Lunch,£23.21,In stock,Three,https://books.toscrape.com/three-martini-lunch_290/index.html
"Thinking, Fast and Slow",£21.14,In stock,One,https://books.toscrape.com/thinking-fast-and-slow_289/index.html
The Wild Robot,£56.07,In stock,Three,https://books.toscrape.com/the-wild-robot_288/index.html
"The Wicked + The Divine, Vol. 3: Commercial Suicide (The Wicked + The Divine)",£14.41,In stock,Three,https://books.toscrape.com/the-wicked-the-divine-vol-3-commercial-suicide-the-wicked-the-divine_287/index.html
The Undomestic Goddess,£45.75,In stock,Four,https://books.toscrape.com/the-undomestic-goddess_286/index.html
The Travelers,£15.77,In stock,One,https://books.toscrape.com/the-travelers_285/index.html
The Tipping Point: How Little Things Can Make a Big Difference,£10.02,In stock,Two,https://books.toscrape.com/the-tipping-point-how-little-things-can-make-a-big-difference_284/index.html
The Thing About Jellyfish,£48.77,In stock,One,https://books.toscrape.com/the-thing-about-jellyfish_283/index.html
The Stand,£57.86,In stock,Two,https://books.toscrape.com/the-stand_282/index.html
The Smitten Kitchen Cookbook,£23.59,In stock,One,https://books.toscrape.com/the-smitten-kitchen-cookbook_281/index.html
The Silkworm (Cormoran Strike #2),£23.05,In stock,Five,https://books.toscrape.com/the-silkworm-cormoran-strike-2_280/index.html
"The Sandman, Vol. 3: Dream Country (The Sandman (volumes) #3)",£55.55,In stock,Five,https://books.toscrape.com/the-sandman-vol-3-dream-country-the-sandman-volumes-3_279/index.html
The Rose & the Dagger (The Wrath and the Dawn #2),£58.64,In stock,Four,https://books.toscrape.com/the-rose-the-dagger-the-wrath-and-the-dawn-2_278/index.html
The Road to Little Dribbling: Adventures of an American in Britain (Notes From a Small Island #2),£23.21,In stock,One,https://books.toscrape.com/the-road-to-little-dribbling-adventures-of-an-american-in-britain-notes-from-a-small-island-2_277/index.html
The Rise of Theodore Roosevelt (Theodore Roosevelt #1),£42.57,In stock,Three,https://books.toscrape.com/the-rise-of-theodore-roosevelt-theodore-roosevelt-1_276/index.html
The Restaurant at the End of the Universe (Hitchhiker's Guide to the Galaxy #2),£10.92,In stock,One,https://books.toscrape.com/the-restaurant-at-the-end-of-the-universe-hitchhikers-guide-to-the-galaxy-2_275/index.html
The Rest Is Noise: Listening to the Twentieth Century,£34.77,In stock,One,https://books.toscrape.com/the-rest-is-noise-listening-to-the-twentieth-century_274/index.html
The Red Tent,£35.66,In stock,Five,https://books.toscrape.com/the-red-tent_273/index.html
The Purpose Driven Life: What on Earth Am I Here for?,£37.19,In stock,Three,https://books.toscrape.com/the-purpose-driven-life-what-on-earth-am-i-here-for_272/index.html
The Purest Hook (Second Circle Tattoos #3),£12.25,In stock,One,https://books.toscrape.com/the-purest-hook-second-circle-tattoos-3_271/index.html
The Picture of Dorian Gray,£29.70,In stock,Two,https://books.toscrape.com/the-picture-of-dorian-gray_270/index.html
The Paris Wife,£36.80,In stock,Three,https://books.toscrape.com/the-paris-wife_269/index.html
The Obsession,£45.43,In stock,One,https://books.toscrape.com/the-obsession_268/index.html
The Nightingale,£26.26,In stock,Four,https://books.toscrape.com/the-nightingale_267/index.html
The New Guy (and Other Senior Year Distractions),£44.92,In stock,Three,https://books.toscrape.com/the-new-guy-and-other-senior-year-distractions_266/index.html
The Nanny Diaries (Nanny #1),£52.53,In stock,Five,https://books.toscrape.com/the-nanny-diaries-nanny-1_265/index.html
The Name of God is Mercy,£37.25,In stock,Two,https://books.toscrape.com/the-name-of-god-is-mercy_264/index.html
The Maze Runner (The Maze Runner #1),£20.93,In stock,One,https://books.toscrape.com/the-maze-runner-the-maze-runner-1_263/index.html
The Lover's Dictionary,£58.09,In stock,Two,https://books.toscrape.com/the-lovers-dictionary_262/index.html
The Lonely Ones,£43.59,In stock,Five,https://books.toscrape.com/the-lonely-ones_261/index.html
The Lean Startup: How Today's Entrepreneurs Use Continuous Innovation to Create Radically Successful Businesses,£33.92,In stock,Three,https://books.toscrape.com/the-lean-startup-how-todays-entrepreneurs-use-continuous-innovation-to-create-radically-successful-businesses_260/index.html
The Last Painting of Sara de Vos,£55.55,In stock,Two,https://books.toscrape.com/the-last-painting-of-sara-de-vos_259/index.html
"The Land of 10,000 Madonnas",£29.64,In stock,Four,https://books.toscrape.com/the-land-of-10000-madonnas_258/index.html
The Infinities,£27.41,In stock,One,https://books.toscrape.com/the-infinities_257/index.html
The Husband's Secret,£52.51,In stock,Five,https://books.toscrape.com/the-husbands-secret_256/index.html
The Hitchhiker's Guide to the Galaxy (Hitchhiker's Guide to the Galaxy #1),£47.80,In stock,Three,https://books.toscrape.com/the-hitchhikers-guide-to-the-galaxy-hitchhikers-guide-to-the-galaxy-1_255/index.html
The Guns of August,£14.54,In stock,Two,https://books.toscrape.com/the-guns-of-august_254/index.html
The Guernsey Literary and Potato Peel Pie Society,£49.53,In stock,One,https://books.toscrape.com/the-guernsey-literary-and-potato-peel-pie-society_253/index.html
The Goldfinch,£43.58,In stock,Three,https://books.toscrape.com/the-goldfinch_252/index.html
The Giver (The Giver Quartet #1),£12.30,In stock,One,https://books.toscrape.com/the-giver-the-giver-quartet-1_251/index.html
The Girl with All the Gifts,£49.47,In stock,Three,https://books.toscrape.com/the-girl-with-all-the-gifts_250/index.html
The Girl Who Played with Fire (Millennium Trilogy #2),£22.14,In stock,Two,https://books.toscrape.com/the-girl-who-played-with-fire-millennium-trilogy-2_249/index.html
The Girl Who Kicked the Hornet's Nest (Millennium Trilogy #3),£57.48,In stock,One,https://books.toscrape.com/the-girl-who-kicked-the-hornets-nest-millennium-trilogy-3_248/index.html
The Exiled,£43.45,In stock,Three,https://books.toscrape.com/the-exiled_247/index.html
"The End of Faith: Religion, Terror, and the Future of Reason",£22.13,In stock,Four,https://books.toscrape.com/the-end-of-faith-religion-terror-and-the-future-of-reason_246/index.html
"The Elegant Universe: Superstrings, Hidden Dimensions, and the Quest for the Ultimate Theory",£13.03,In stock,Four,https://books.toscrape.com/the-elegant-universe-superstrings-hidden-dimensions-and-the-quest-for-the-ultimate-theory_245/index.html
"The Disappearing Spoon: And Other True Tales of Madness, Love, and the History of the World from the Periodic Table of the Elements",£57.35,In stock,Five,https://books.toscrape.com/the-disappearing-spoon-and-other-true-tales-of-madness-love-and-the-history-of-the-world-from-the-periodic-table-of-the-elements_244/index.html
The Devil Wears Prada (The Devil Wears Prada #1),£44.29,In stock,One,https://books.toscrape.com/the-devil-wears-prada-the-devil-wears-prada-1_243/index.html
The Demon-Haunted World: Science as a Candle in the Dark,£52.25,In stock,Four,https://books.toscrape.com/the-demon-haunted-world-science-as-a-candle-in-the-dark_242/index.html
The Day the Crayons Came Home (Crayons),£26.33,In stock,Five,https://books.toscrape.com/the-day-the-crayons-came-home-crayons_241/index.html
The Da Vinci Code (Robert Langdon #2),£22.96,In stock,Two,https://books.toscrape.com/the-da-vinci-code-robert-langdon-2_240/index.html
The Cuckoo's Calling (Cormoran Strike #1),£19.21,In stock,One,https://books.toscrape.com/the-cuckoos-calling-cormoran-strike-1_239/index.html
The Complete Stories and Poems (The Works of Edgar Allan Poe [Cameo Edition]),£26.78,In stock,Four,https://books.toscrape.com/the-complete-stories-and-poems-the-works-of-edgar-allan-poe-cameo-edition_238/index.html
The Complete Poems,£41.32,In stock,Five,https://books.toscrape.com/the-complete-poems_237/index.html
The Catcher in the Rye,£24.55,In stock,One,https://books.toscrape.com/the-catcher-in-the-rye_236/index.html
The Cat in the Hat (Beginner Books B-1),£16.26,In stock,Two,https://books.toscrape.com/the-cat-in-the-hat-beginner-books-b-1_235/index.html
The Case for Christ (Cases for Christianity),£47.84,In stock,One,https://books.toscrape.com/the-case-for-christ-cases-for-christianity_234/index.html
The Book Thief,£53.49,In stock,Two,https://books.toscrape.com/the-book-thief_233/index.html
The Book of Basketball: The NBA According to The Sports Guy,£44.84,In stock,Five,https://books.toscrape.com/the-book-of-basketball-the-nba-according-to-the-sports-guy_232/index.html
The Blind Side: Evolution of a Game,£53.71,In stock,Five,https://books.toscrape.com/the-blind-side-evolution-of-a-game_231/index.html
The Autobiography of Malcolm X,£23.43,In stock,Two,https://books.toscrape.com/the-autobiography-of-malcolm-x_230/index.html
"The Art of Simple Food: Notes, Lessons, and Recipes from a Delicious Revolution",£34.32,In stock,Three,https://books.toscrape.com/the-art-of-simple-food-notes-lessons-and-recipes-from-a-delicious-revolution_229/index.html
The Art of Fielding,£22.10,In stock,One,https://books.toscrape.com/the-art-of-fielding_228/index.html
"Surely You're Joking, Mr. Feynman!: Adventures of a Curious Character",£25.83,In stock,Two,https://books.toscrape.com/surely-youre-joking-mr-feynman-adventures-of-a-curious-character_227/index.html
Stiff: The Curious Lives of Human Cadavers,£36.74,In stock,Three,https://books.toscrape.com/stiff-the-curious-lives-of-human-cadavers_226/index.html
Spilled Milk: Based on a True Story,£49.51,In stock,One,https://books.toscrape.com/spilled-milk-based-on-a-true-story_225/index.html
Something Borrowed (Darcy & Rachel #1),£48.96,In stock,Five,https://books.toscrape.com/something-borrowed-darcy-rachel-1_224/index.html
Something Blue (Darcy & Rachel #2),£54.62,In stock,One,https://books.toscrape.com/something-blue-darcy-rachel-2_223/index.html
Soldier (Talon #3),£24.72,In stock,Two,https://books.toscrape.com/soldier-talon-3_222/index.html
Shopaholic & Baby (Shopaholic #5),£46.45,In stock,Two,https://books.toscrape.com/shopaholic-baby-shopaholic-5_221/index.html
Seven Days in the Art World,£52.33,In stock,Two,https://books.toscrape.com/seven-days-in-the-art-world_220/index.html
Seven Brief Lessons on Physics,£30.60,In stock,Four,https://books.toscrape.com/seven-brief-lessons-on-physics_219/index.html
Scarlet (The Lunar Chronicles #2),£14.57,In stock,Four,https://books.toscrape.com/scarlet-the-lunar-chronicles-2_218/index.html
Sarah's Key,£46.29,In stock,One,https://books.toscrape.com/sarahs-key_217/index.html
"Saga, Volume 3 (Saga (Collected Editions) #3)",£21.57,In stock,Five,https://books.toscrape.com/saga-volume-3-saga-collected-editions-3_216/index.html
Running with Scissors,£12.91,In stock,Four,https://books.toscrape.com/running-with-scissors_215/index.html
Rogue Lawyer (Rogue Lawyer #1),£50.11,In stock,Three,https://books.toscrape.com/rogue-lawyer-rogue-lawyer-1_214/index.html
"Rise of the Rocket Girls: The Women Who Propelled Us, from Missiles to the Moon to Mars",£41.67,In stock,Four,https://books.toscrape.com/rise-of-the-rocket-girls-the-women-who-propelled-us-from-missiles-to-the-moon-to-mars_213/index.html
Rework,£44.88,In stock,Two,https://books.toscrape.com/rework_212/index.html
Reservations for Two,£11.10,In stock,Three,https://books.toscrape.com/reservations-for-two_211/index.html
Red: The True Story of Red Riding Hood,£28.54,In stock,Three,https://books.toscrape.com/red-the-true-story-of-red-riding-hood_210/index.html
Ready Player One,£19.07,In stock,Four,https://books.toscrape.com/ready-player-one_209/index.html
Quiet: The Power of Introverts in a World That Can't Stop Talking,£43.55,In stock,One,https://books.toscrape.com/quiet-the-power-of-introverts-in-a-world-that-cant-stop-talking_208/index.html
Prodigy: The Graphic Novel (Legend: The Graphic Novel #2),£43.63,In stock,Three,https://books.toscrape.com/prodigy-the-graphic-novel-legend-the-graphic-novel-2_207/index.html
Persepolis: The Story of a Childhood (Persepolis #1-2),£39.13,In stock,One,https://books.toscrape.com/persepolis-the-story-of-a-childhood-persepolis-1-2_206/index.html
Packing for Mars: The Curious Science of Life in the Void,£56.68,In stock,Two,https://books.toscrape.com/packing-for-mars-the-curious-science-of-life-in-the-void_205/index.html
Outliers: The Story of Success,£14.16,In stock,One,https://books.toscrape.com/outliers-the-story-of-success_204/index.html
Original Fake,£31.45,In stock,Three,https://books.toscrape.com/original-fake_203/index.html
Orange Is the New Black,£24.61,In stock,Two,https://books.toscrape.com/orange-is-the-new-black_202/index.html
One for the Money (Stephanie Plum #1),£32.87,In stock,Two,https://books.toscrape.com/one-for-the-money-stephanie-plum-1_201/index.html
Notes from a Small Island (Notes From a Small Island #1),£40.17,In stock,One,https://books.toscrape.com/notes-from-a-small-island-notes-from-a-small-island-1_200/index.html
Night (The Night Trilogy #1),£13.51,In stock,One,https://books.toscrape.com/night-the-night-trilogy-1_199/index.html
Neither Here nor There: Travels in Europe,£38.95,In stock,Three,https://books.toscrape.com/neither-here-nor-there-travels-in-europe_198/index.html
Naked,£31.69,In stock,Three,https://books.toscrape.com/naked_197/index.html
Morning Star (Red Rising #3),£29.40,In stock,One,https://books.toscrape.com/morning-star-red-rising-3_196/index.html
"Miracles from Heaven: A Little Girl, Her Journey to Heaven, and Her Amazing Story of Healing",£57.83,In stock,One,https://books.toscrape.com/miracles-from-heaven-a-little-girl-her-journey-to-heaven-and-her-amazing-story-of-healing_195/index.html
Midnight Riot (Peter Grant/ Rivers of London - books #1),£55.46,In stock,Two,https://books.toscrape.com/midnight-riot-peter-grant-rivers-of-london-books-1_194/index.html
Me Talk Pretty One Day,£57.60,In stock,Two,https://books.toscrape.com/me-talk-pretty-one-day_193/index.html
Manuscript Found in Accra,£34.98,In stock,Two,https://books.toscrape.com/manuscript-found-in-accra_192/index.html
Lust & Wonder,£11.87,In stock,Two,https://books.toscrape.com/lust-wonder_191/index.html
Lila (Gilead #3),£12.47,In stock,Three,https://books.toscrape.com/lila-gilead-3_190/index.html
"Life, the Universe and Everything (Hitchhiker's Guide to the Galaxy #3)",£33.26,In stock,Two,https://books.toscrape.com/life-the-universe-and-everything-hitchhikers-guide-to-the-galaxy-3_189/index.html
Life Without a Recipe,£59.04,In stock,Five,https://books.toscrape.com/life-without-a-recipe_188/index.html
Life After Life,£26.13,In stock,Two,https://books.toscrape.com/life-after-life_187/index.html
Letter to a Christian Nation,£22.20,In stock,One,https://books.toscrape.com/letter-to-a-christian-nation_186/index.html
Let's Pretend This Never Happened: A Mostly True Memoir,£45.11,In stock,One,https://books.toscrape.com/lets-pretend-this-never-happened-a-mostly-true-memoir_185/index.html
Legend (Legend #1),£43.69,In stock,Four,https://books.toscrape.com/legend-legend-1_184/index.html
"Lean In: Women, Work, and the Will to Lead",£25.02,In stock,One,https://books.toscrape.com/lean-in-women-work-and-the-will-to-lead_183/index.html
"Lamb: The Gospel According to Biff, Christ's Childhood Pal",£55.50,In stock,Five,https://books.toscrape.com/lamb-the-gospel-according-to-biff-christs-childhood-pal_182/index.html
Lady Renegades (Rebel Belle #3),£53.04,In stock,Five,https://books.toscrape.com/lady-renegades-rebel-belle-3_181/index.html
Jurassic Park (Jurassic Park #1),£44.97,In stock,One,https://books.toscrape.com/jurassic-park-jurassic-park-1_180/index.html
It's Never Too Late to Begin Again: Discovering Creativity and Meaning at Midlife and Beyond,£42.38,In stock,One,https://books.toscrape.com/its-never-too-late-to-begin-again-discovering-creativity-and-meaning-at-midlife-and-beyond_179/index.html
Is Everyone Hanging Out Without Me? (And Other Concerns),£20.11,In stock,Three,https://books.toscrape.com/is-everyone-hanging-out-without-me-and-other-concerns_178/index.html
Into the Wild,£56.70,In stock,Five,https://books.toscrape.com/into-the-wild_177/index.html
Inferno (Robert Langdon #4),£41.00,In stock,Five,https://books.toscrape.com/inferno-robert-langdon-4_176/index.html
"In the Garden of Beasts: Love, Terror, and an American Family in Hitler's Berlin",£28.85,In stock,Three,https://books.toscrape.com/in-the-garden-of-beasts-love-terror-and-an-american-family-in-hitlers-berlin_175/index.html
If I Run (If I Run #1),£49.97,In stock,Four,https://books.toscrape.com/if-i-run-if-i-run-1_174/index.html
I've Got Your Number,£19.69,In stock,One,https://books.toscrape.com/ive-got-your-number_173/index.html
I Am Malala: The Girl Who Stood Up for Education and Was Shot by the Taliban,£28.88,In stock,Two,https://books.toscrape.com/i-am-malala-the-girl-who-stood-up-for-education-and-was-shot-by-the-taliban_172/index.html
Hungry Girl Clean & Hungry: Easy All-Natural Recipes for Healthy Eating in the Real World,£33.14,In stock,Three,https://books.toscrape.com/hungry-girl-clean-hungry-easy-all-natural-recipes-for-healthy-eating-in-the-real-world_171/index.html
"House of Lost Worlds: Dinosaurs, Dynasties, and the Story of Life on Earth",£43.70,In stock,Two,https://books.toscrape.com/house-of-lost-worlds-dinosaurs-dynasties-and-the-story-of-life-on-earth_170/index.html
House of Leaves,£54.89,In stock,One,https://books.toscrape.com/house-of-leaves_169/index.html
Horrible Bear!,£37.52,In stock,Two,https://books.toscrape.com/horrible-bear_168/index.html
Holidays on Ice,£51.07,In stock,Two,https://books.toscrape.com/holidays-on-ice_167/index.html
Heir to the Sky,£44.07,In stock,Four,https://books.toscrape.com/heir-to-the-sky_166/index.html
Green Eggs and Ham (Beginner Books B-16),£10.79,In stock,Four,https://books.toscrape.com/green-eggs-and-ham-beginner-books-b-16_165/index.html
"Grayson, Vol 3: Nemesis (Grayson #3)",£42.72,In stock,One,https://books.toscrape.com/grayson-vol-3-nemesis-grayson-3_164/index.html
Gratitude,£26.66,In stock,Five,https://books.toscrape.com/gratitude_163/index.html
Gone Girl,£37.60,In stock,Five,https://books.toscrape.com/gone-girl_162/index.html
Golden (Heart of Dread #3),£42.21,In stock,Four,https://books.toscrape.com/golden-heart-of-dread-3_161/index.html
Girl in the Blue Coat,£46.83,In stock,Two,https://books.toscrape.com/girl-in-the-blue-coat_160/index.html
"Fruits Basket, Vol. 3 (Fruits Basket #3)",£45.17,In stock,Two,https://books.toscrape.com/fruits-basket-vol-3-fruits-basket-3_159/index.html
"Friday Night Lights: A Town, a Team, and a Dream",£51.22,In stock,Three,https://books.toscrape.com/friday-night-lights-a-town-a-team-and-a-dream_158/index.html
Fire Bound (Sea Haven/Sisters of the Heart #5),£21.28,In stock,Four,https://books.toscrape.com/fire-bound-sea-havensisters-of-the-heart-5_157/index.html
Fifty Shades Freed (Fifty Shades #3),£15.36,In stock,Five,https://books.toscrape.com/fifty-shades-freed-fifty-shades-3_156/index.html
Fellside,£38.62,In stock,One,https://books.toscrape.com/fellside_155/index.html
Extreme Prey (Lucas Davenport #26),£25.40,In stock,Three,https://books.toscrape.com/extreme-prey-lucas-davenport-26_154/index.html
Eragon (The Inheritance Cycle #1),£43.87,In stock,Three,https://books.toscrape.com/eragon-the-inheritance-cycle-1_153/index.html
Eclipse (Twilight #3),£18.74,In stock,One,https://books.toscrape.com/eclipse-twilight-3_152/index.html
Dune (Dune #1),£54.86,In stock,One,https://books.toscrape.com/dune-dune-1_151/index.html
Dracula,£52.62,In stock,Three,https://books.toscrape.com/dracula_150/index.html
Do Androids Dream of Electric Sheep? (Blade Runner #1),£51.48,In stock,One,https://books.toscrape.com/do-androids-dream-of-electric-sheep-blade-runner-1_149/index.html
Disrupted: My Misadventure in the Start-Up Bubble,£15.28,In stock,Five,https://books.toscrape.com/disrupted-my-misadventure-in-the-start-up-bubble_148/index.html
Dead Wake: The Last Crossing of the Lusitania,£39.24,In stock,Five,https://books.toscrape.com/dead-wake-the-last-crossing-of-the-lusitania_147/index.html
"David and Goliath: Underdogs, Misfits, and the Art of Battling Giants",£17.81,In stock,One,https://books.toscrape.com/david-and-goliath-underdogs-misfits-and-the-art-of-battling-giants_146/index.html
Darkfever (Fever #1),£56.02,In stock,One,https://books.toscrape.com/darkfever-fever-1_145/index.html
Dark Places,£23.90,In stock,Five,https://books.toscrape.com/dark-places_144/index.html
Crazy Rich Asians (Crazy Rich Asians #1),£49.13,In stock,Five,https://books.toscrape.com/crazy-rich-asians-crazy-rich-asians-1_143/index.html
Counting Thyme,£10.62,In stock,One,https://books.toscrape.com/counting-thyme_142/index.html
Cosmos,£36.17,In stock,Two,https://books.toscrape.com/cosmos_141/index.html
Civilization and Its Discontents,£59.95,In stock,Two,https://books.toscrape.com/civilization-and-its-discontents_140/index.html
Cinder (The Lunar Chronicles #1),£26.09,In stock,One,https://books.toscrape.com/cinder-the-lunar-chronicles-1_139/index.html
Catastrophic Happiness: Finding Joy in Childhood's Messy Years,£37.35,In stock,Two,https://books.toscrape.com/catastrophic-happiness-finding-joy-in-childhoods-messy-years_138/index.html
Career of Evil (Cormoran Strike #3),£24.72,In stock,Two,https://books.toscrape.com/career-of-evil-cormoran-strike-3_137/index.html
Breaking Dawn (Twilight #4),£35.28,In stock,Five,https://books.toscrape.com/breaking-dawn-twilight-4_136/index.html
Brave Enough,£51.32,In stock,Five,https://books.toscrape.com/brave-enough_135/index.html
Boy Meets Boy,£21.12,In stock,Three,https://books.toscrape.com/boy-meets-boy_134/index.html
"Born to Run: A Hidden Tribe, Superathletes, and the Greatest Race the World Has Never Seen",£27.35,In stock,Two,https://books.toscrape.com/born-to-run-a-hidden-tribe-superathletes-and-the-greatest-race-the-world-has-never-seen_133/index.html
Blink: The Power of Thinking Without Thinking,£21.74,In stock,Five,https://books.toscrape.com/blink-the-power-of-thinking-without-thinking_132/index.html
Black Flags: The Rise of ISIS,£40.87,In stock,One,https://books.toscrape.com/black-flags-the-rise-of-isis_131/index.html
"Black Butler, Vol. 1 (Black Butler #1)",£49.31,In stock,One,https://books.toscrape.com/black-butler-vol-1-black-butler-1_130/index.html
Big Little Lies,£22.11,In stock,One,https://books.toscrape.com/big-little-lies_129/index.html
Between Shades of Gray,£20.79,In stock,Five,https://books.toscrape.com/between-shades-of-gray_128/index.html
Best of My Love (Fool's Gold #20),£27.41,In stock,Two,https://books.toscrape.com/best-of-my-love-fools-gold-20_127/index.html
Beowulf,£38.35,In stock,Two,https://books.toscrape.com/beowulf_126/index.html
Beautiful Creatures (Caster Chronicles #1),£21.55,In stock,Five,https://books.toscrape.com/beautiful-creatures-caster-chronicles-1_125/index.html
Awkward,£38.02,In stock,Two,https://books.toscrape.com/awkward_124/index.html
Ash,£22.06,In stock,Four,https://books.toscrape.com/ash_123/index.html
Are We There Yet?,£10.66,In stock,Three,https://books.toscrape.com/are-we-there-yet_122/index.html
Are We Smart Enough to Know How Smart Animals Are?,£56.58,In stock,One,https://books.toscrape.com/are-we-smart-enough-to-know-how-smart-animals-are_121/index.html
Annie on My Mind,£36.83,In stock,Five,https://books.toscrape.com/annie-on-my-mind_120/index.html
And Then There Were None,£35.01,In stock,Two,https://books.toscrape.com/and-then-there-were-none_119/index.html
A Walk in the Woods: Rediscovering America on the Appalachian Trail,£30.48,In stock,Four,https://books.toscrape.com/a-walk-in-the-woods-rediscovering-america-on-the-appalachian-trail_118/index.html
A Visit from the Goon Squad,£14.08,In stock,Five,https://books.toscrape.com/a-visit-from-the-goon-squad_117/index.html
A Storm of Swords (A Song of Ice and Fire #3),£31.22,In stock,Two,https://books.toscrape.com/a-storm-of-swords-a-song-of-ice-and-fire-3_116/index.html
A Heartbreaking Work of Staggering Genius,£54.29,In stock,Five,https://books.toscrape.com/a-heartbreaking-work-of-staggering-genius_115/index.html
8 Keys to Mental Health Through Exercise,£31.04,In stock,One,https://books.toscrape.com/8-keys-to-mental-health-through-exercise_114/index.html
#GIRLBOSS,£50.96,In stock,One,https://books.toscrape.com/girlboss_113/index.html
"The Suffragettes (Little Black Classics, #96)",£11.89,In stock,Two,https://books.toscrape.com/the-suffragettes-little-black-classics-96_112/index.html
The Sense of an Ending,£31.38,In stock,Three,https://books.toscrape.com/the-sense-of-an-ending_111/index.html
"The Sandman, Vol. 2: The Doll's House (The Sandman (volumes) #2)",£54.81,In stock,One,https://books.toscrape.com/the-sandman-vol-2-the-dolls-house-the-sandman-volumes-2_110/index.html
The Course of Love,£16.78,In stock,Three,https://books.toscrape.com/the-course-of-love_109/index.html
Sugar Rush (Offensive Line #2),£24.42,In stock,One,https://books.toscrape.com/sugar-rush-offensive-line-2_108/index.html
"Saga, Volume 2 (Saga (Collected Editions) #2)",£11.75,In stock,Three,https://books.toscrape.com/saga-volume-2-saga-collected-editions-2_107/index.html
"Run, Spot, Run: The Ethics of Keeping Pets",£20.02,In stock,One,https://books.toscrape.com/run-spot-run-the-ethics-of-keeping-pets_106/index.html
New Moon (Twilight #2),£12.86,In stock,Four,https://books.toscrape.com/new-moon-twilight-2_105/index.html
Life,£31.58,In stock,Five,https://books.toscrape.com/life_104/index.html
