title,price,availability,rating,link
A Light in the Attic,£51.77,In stock,Three,https://books.toscrape.com/catalogue/a-light-in-the-attic_1000/index.html
Tipping the Velvet,£53.74,In stock,One,https://books.toscrape.com/catalogue/tipping-the-velvet_999/index.html
Soumission,£50.10,In stock,One,https://books.toscrape.com/catalogue/soumission_998/index.html
Sharp Objects,£47.82,In stock,Four,https://books.toscrape.com/catalogue/sharp-objects_997/index.html
Sapiens: A Brief History of Humankind,£54.23,In stock,Five,https://books.toscrape.com/catalogue/sapiens-a-brief-history-of-humankind_996/index.html
The Requiem Red,£22.65,In stock,One,https://books.toscrape.com/catalogue/the-requiem-red_995/index.html
The Dirty Little Secrets of Getting Your Dream Job,£33.34,In stock,Four,https://books.toscrape.com/catalogue/the-dirty-little-secrets-of-getting-your-dream-job_994/index.html
"The Coming Woman: A Novel Based on the Life of the Infamous Feminist, Victoria Woodhull",£17.93,In stock,Three,https://books.toscrape.com/catalogue/the-coming-woman-a-novel-based-on-the-life-of-the-infamous-feminist-victoria-woodhull_993/index.html
The Boys in the Boat: Nine Americans and Their Epic Quest for Gold at the 1936 Berlin Olympics,£22.60,In stock,Four,https://books.toscrape.com/catalogue/the-boys-in-the-boat-nine-americans-and-their-epic-quest-for-gold-at-the-1936-berlin-olympics_992/index.html
The Black Maria,£52.15,In stock,One,https://books.toscrape.com/catalogue/the-black-maria_991/index.html
"Starving Hearts (Triangular Trade Trilogy, #1)",£13.99,In stock,Two,https://books.toscrape.com/catalogue/starving-hearts-triangular-trade-trilogy-1_990/index.html
Shakespeare's Sonnets,£20.66,In stock,Four,https://books.toscrape.com/catalogue/shakespeares-sonnets_989/index.html
Set Me Free,£17.46,In stock,Five,https://books.toscrape.com/catalogue/set-me-free_988/index.html
Scott Pilgrim's Precious Little Life (Scott Pilgrim #1),£52.29,In stock,Five,https://books.toscrape.com/catalogue/scott-pilgrims-precious-little-life-scott-pilgrim-1_987/index.html
Rip it Up and Start Again,£35.02,In stock,Five,https://books.toscrape.com/catalogue/rip-it-up-and-start-again_986/index.html
"Our Band Could Be Your Life: Scenes from the American Indie Underground, 1981-1991",£57.25,In stock,Three,https://books.toscrape.com/catalogue/our-band-could-be-your-life-scenes-from-the-american-indie-underground-1981-1991_985/index.html
Olio,£23.88,In stock,One,https://books.toscrape.com/catalogue/olio_984/index.html
Mesaerion: The Best Science Fiction Stories 1800-1849,£37.59,In stock,One,https://books.toscrape.com/catalogue/mesaerion-the-best-science-fiction-stories-1800-1849_983/index.html
Libertarianism for Beginners,£51.33,In stock,Two,https://books.toscrape.com/catalogue/libertarianism-for-beginners_982/index.html
It's Only the Himalayas,£45.17,In stock,Two,https://books.toscrape.com/catalogue/its-only-the-himalayas_981/index.html
In Her Wake,£12.84,In stock,One,https://books.toscrape.com/in-her-wake_980/index.html
How Music Works,£37.32,In stock,Two,https://books.toscrape.com/how-music-works_979/index.html
"Foolproof Preserving: A Guide to Small Batch Jams, Jellies, Pickles, Condiments, and More: A Foolproof Guide to Making Small Batch Jams, Jellies, Pickles, Condiments, and More",£30.52,In stock,Three,https://books.toscrape.com/foolproof-preserving-a-guide-to-small-batch-jams-jellies-pickles-condiments-and-more-a-foolproof-guide-to-making-small-batch-jams-jellies-pickles-condiments-and-more_978/index.html
Chase Me (Paris Nights #2),£25.27,In stock,Five,https://books.toscrape.com/chase-me-paris-nights-2_977/index.html
Black Dust,£34.53,In stock,Five,https://books.toscrape.com/black-dust_976/index.html
Birdsong: A Story in Pictures,£54.64,In stock,Three,https://books.toscrape.com/birdsong-a-story-in-pictures_975/index.html
America's Cradle of Quarterbacks: Western Pennsylvania's Football Factory from Johnny Unitas to Joe Montana,£22.50,In stock,Three,https://books.toscrape.com/americas-cradle-of-quarterbacks-western-pennsylvanias-football-factory-from-johnny-unitas-to-joe-montana_974/index.html
Aladdin and His Wonderful Lamp,£53.13,In stock,Three,https://books.toscrape.com/aladdin-and-his-wonderful-lamp_973/index.html
Worlds Elsewhere: Journeys Around Shakespeare’s Globe,£40.30,In stock,Five,https://books.toscrape.com/worlds-elsewhere-journeys-around-shakespeares-globe_972/index.html
Wall and Piece,£44.18,In stock,Four,https://books.toscrape.com/wall-and-piece_971/index.html
The Four Agreements: A Practical Guide to Personal Freedom,£17.66,In stock,Five,https://books.toscrape.com/the-four-agreements-a-practical-guide-to-personal-freedom_970/index.html
The Five Love Languages: How to Express Heartfelt Commitment to Your Mate,£31.05,In stock,Three,https://books.toscrape.com/the-five-love-languages-how-to-express-heartfelt-commitment-to-your-mate_969/index.html
The Elephant Tree,£23.82,In stock,Five,https://books.toscrape.com/the-elephant-tree_968/index.html
The Bear and the Piano,£36.89,In stock,One,https://books.toscrape.com/the-bear-and-the-piano_967/index.html
Sophie's World,£15.94,In stock,Five,https://books.toscrape.com/sophies-world_966/index.html
Penny Maybe,£33.29,In stock,Three,https://books.toscrape.com/penny-maybe_965/index.html
Maude (1883-1993):She Grew Up with the country,£18.02,In stock,Two,https://books.toscrape.com/maude-1883-1993she-grew-up-with-the-country_964/index.html
"In a Dark, Dark Wood",£19.63,In stock,One,https://books.toscrape.com/in-a-dark-dark-wood_963/index.html
Behind Closed Doors,£52.22,In stock,Four,https://books.toscrape.com/behind-closed-doors_962/index.html
You can't bury them all: Poems,£33.63,In stock,Two,https://books.toscrape.com/you-cant-bury-them-all-poems_961/index.html
Slow States of Collapse: Poems,£57.31,In stock,Three,https://books.toscrape.com/slow-states-of-collapse-poems_960/index.html
Reasons to Stay Alive,£26.41,In stock,Two,https://books.toscrape.com/reasons-to-stay-alive_959/index.html
Private Paris (Private #10),£47.61,In stock,Five,https://books.toscrape.com/private-paris-private-10_958/index.html
#HigherSelfie: Wake Up Your Life. Free Your Soul. Find Your Tribe.,£23.11,In stock,Five,https://books.toscrape.com/higherselfie-wake-up-your-life-free-your-soul-find-your-tribe_957/index.html
Without Borders (Wanderlove #1),£45.07,In stock,Two,https://books.toscrape.com/without-borders-wanderlove-1_956/index.html
When We Collided,£31.77,In stock,One,https://books.toscrape.com/when-we-collided_955/index.html
"We Love You, Charlie Freeman",£50.27,In stock,Five,https://books.toscrape.com/we-love-you-charlie-freeman_954/index.html
Untitled Collection: Sabbath Poems 2014,£14.27,In stock,Four,https://books.toscrape.com/untitled-collection-sabbath-poems-2014_953/index.html
"Unseen City: The Majesty of Pigeons, the Discreet Charm of Snails & Other Wonders of the Urban Wilderness",£44.18,In stock,Four,https://books.toscrape.com/unseen-city-the-majesty-of-pigeons-the-discreet-charm-of-snails-other-wonders-of-the-urban-wilderness_952/index.html
Unicorn Tracks,£18.78,In stock,Three,https://books.toscrape.com/unicorn-tracks_951/index.html
"Unbound: How Eight Technologies Made Us Human, Transformed Society, and Brought Our World to the Brink",£25.52,In stock,One,https://books.toscrape.com/unbound-how-eight-technologies-made-us-human-transformed-society-and-brought-our-world-to-the-brink_950/index.html
Tsubasa: WoRLD CHRoNiCLE 2 (Tsubasa WoRLD CHRoNiCLE #2),£16.28,In stock,One,https://books.toscrape.com/tsubasa-world-chronicle-2-tsubasa-world-chronicle-2_949/index.html
Throwing Rocks at the Google Bus: How Growth Became the Enemy of Prosperity,£31.12,In stock,Three,https://books.toscrape.com/throwing-rocks-at-the-google-bus-how-growth-became-the-enemy-of-prosperity_948/index.html
This One Summer,£19.49,In stock,Four,https://books.toscrape.com/this-one-summer_947/index.html
Thirst,£17.27,In stock,Five,https://books.toscrape.com/thirst_946/index.html
The Torch Is Passed: A Harding Family Story,£19.09,In stock,One,https://books.toscrape.com/the-torch-is-passed-a-harding-family-story_945/index.html
The Secret of Dreadwillow Carse,£56.13,In stock,One,https://books.toscrape.com/the-secret-of-dreadwillow-carse_944/index.html
"The Pioneer Woman Cooks: Dinnertime: Comfort Classics, Freezer Food, 16-Minute Meals, and Other Delicious Ways to Solve Supper!",£56.41,In stock,One,https://books.toscrape.com/the-pioneer-woman-cooks-dinnertime-comfort-classics-freezer-food-16-minute-meals-and-other-delicious-ways-to-solve-supper_943/index.html
The Past Never Ends,£56.50,In stock,Four,https://books.toscrape.com/the-past-never-ends_942/index.html
The Natural History of Us (The Fine Art of Pretending #2),£45.22,In stock,Three,https://books.toscrape.com/the-natural-history-of-us-the-fine-art-of-pretending-2_941/index.html
The Nameless City (The Nameless City #1),£38.16,In stock,Four,https://books.toscrape.com/the-nameless-city-the-nameless-city-1_940/index.html
The Murder That Never Was (Forensic Instincts #5),£54.11,In stock,Three,https://books.toscrape.com/the-murder-that-never-was-forensic-instincts-5_939/index.html
The Most Perfect Thing: Inside (and Outside) a Bird's Egg,£42.96,In stock,Four,https://books.toscrape.com/the-most-perfect-thing-inside-and-outside-a-birds-egg_938/index.html
"The Mindfulness and Acceptance Workbook for Anxiety: A Guide to Breaking Free from Anxiety, Phobias, and Worry Using Acceptance and Commitment Therapy",£23.89,In stock,Four,https://books.toscrape.com/the-mindfulness-and-acceptance-workbook-for-anxiety-a-guide-to-breaking-free-from-anxiety-phobias-and-worry-using-acceptance-and-commitment-therapy_937/index.html
The Life-Changing Magic of Tidying Up: The Japanese Art of Decluttering and Organizing,£16.77,In stock,Three,https://books.toscrape.com/the-life-changing-magic-of-tidying-up-the-japanese-art-of-decluttering-and-organizing_936/index.html
"The Inefficiency Assassin: Time Management Tactics for Working Smarter, Not Longer",£20.59,In stock,Five,https://books.toscrape.com/the-inefficiency-assassin-time-management-tactics-for-working-smarter-not-longer_935/index.html
The Gutsy Girl: Escapades for Your Life of Epic Adventure,£37.13,In stock,One,https://books.toscrape.com/the-gutsy-girl-escapades-for-your-life-of-epic-adventure_934/index.html
The Electric Pencil: Drawings from Inside State Hospital No. 3,£56.06,In stock,One,https://books.toscrape.com/the-electric-pencil-drawings-from-inside-state-hospital-no-3_933/index.html
The Death of Humanity: and the Case for Life,£58.11,In stock,Four,https://books.toscrape.com/the-death-of-humanity-and-the-case-for-life_932/index.html
"The Bulletproof Diet: Lose up to a Pound a Day, Reclaim Energy and Focus, Upgrade Your Life",£49.05,In stock,Three,https://books.toscrape.com/the-bulletproof-diet-lose-up-to-a-pound-a-day-reclaim-energy-and-focus-upgrade-your-life_931/index.html
The Art Forger,£40.76,In stock,Three,https://books.toscrape.com/the-art-forger_930/index.html
The Age of Genius: The Seventeenth Century and the Birth of the Modern Mind,£19.73,In stock,One,https://books.toscrape.com/the-age-of-genius-the-seventeenth-century-and-the-birth-of-the-modern-mind_929/index.html
The Activist's Tao Te Ching: Ancient Advice for a Modern Revolution,£32.24,In stock,Five,https://books.toscrape.com/the-activists-tao-te-ching-ancient-advice-for-a-modern-revolution_928/index.html
Spark Joy: An Illustrated Master Class on the Art of Organizing and Tidying Up,£41.83,In stock,Four,https://books.toscrape.com/spark-joy-an-illustrated-master-class-on-the-art-of-organizing-and-tidying-up_927/index.html
Soul Reader,£39.58,In stock,Two,https://books.toscrape.com/soul-reader_926/index.html
Security,£39.25,In stock,Two,https://books.toscrape.com/security_925/index.html
"Saga, Volume 6 (Saga (Collected Editions) #6)",£25.02,In stock,Three,https://books.toscrape.com/saga-volume-6-saga-collected-editions-6_924/index.html
"Saga, Volume 5 (Saga (Collected Editions) #5)",£51.04,In stock,Two,https://books.toscrape.com/saga-volume-5-saga-collected-editions-5_923/index.html
Reskilling America: Learning to Labor in the Twenty-First Century,£19.83,In stock,Two,https://books.toscrape.com/reskilling-america-learning-to-labor-in-the-twenty-first-century_922/index.html
"Rat Queens, Vol. 3: Demons (Rat Queens (Collected Editions) #11-15)",£50.40,In stock,Three,https://books.toscrape.com/rat-queens-vol-3-demons-rat-queens-collected-editions-11-15_921/index.html
"Princess Jellyfish 2-in-1 Omnibus, Vol. 01 (Princess Jellyfish 2-in-1 Omnibus #1)",£13.61,In stock,Five,https://books.toscrape.com/princess-jellyfish-2-in-1-omnibus-vol-01-princess-jellyfish-2-in-1-omnibus-1_920/index.html
Princess Between Worlds (Wide-Awake Princess #5),£13.34,In stock,Five,https://books.toscrape.com/princess-between-worlds-wide-awake-princess-5_919/index.html
"Pop Gun War, Volume 1: Gift",£18.97,In stock,One,https://books.toscrape.com/pop-gun-war-volume-1-gift_918/index.html
"Political Suicide: Missteps, Peccadilloes, Bad Calls, Backroom Hijinx, Sordid Pasts, Rotten Breaks, and Just Plain Dumb Mistakes in the Annals of American Politics",£36.28,In stock,Two,https://books.toscrape.com/political-suicide-missteps-peccadilloes-bad-calls-backroom-hijinx-sordid-pasts-rotten-breaks-and-just-plain-dumb-mistakes-in-the-annals-of-american-politics_917/index.html
Patience,£10.16,In stock,Three,https://books.toscrape.com/patience_916/index.html
"Outcast, Vol. 1: A Darkness Surrounds Him (Outcast #1)",£15.44,In stock,Four,https://books.toscrape.com/outcast-vol-1-a-darkness-surrounds-him-outcast-1_915/index.html
orange: The Complete Collection 1 (orange: The Complete Collection #1),£48.41,In stock,One,https://books.toscrape.com/orange-the-complete-collection-1-orange-the-complete-collection-1_914/index.html
Online Marketing for Busy Authors: A Step-By-Step Guide,£46.35,In stock,One,https://books.toscrape.com/online-marketing-for-busy-authors-a-step-by-step-guide_913/index.html
On a Midnight Clear,£14.07,In stock,Three,https://books.toscrape.com/on-a-midnight-clear_912/index.html
Obsidian (Lux #1),£14.86,In stock,Two,https://books.toscrape.com/obsidian-lux-1_911/index.html
My Paris Kitchen: Recipes and Stories,£33.37,In stock,Two,https://books.toscrape.com/my-paris-kitchen-recipes-and-stories_910/index.html
Masks and Shadows,£56.40,In stock,Two,https://books.toscrape.com/masks-and-shadows_909/index.html
"Mama Tried: Traditional Italian Cooking for the Screwed, Crude, Vegan, and Tattooed",£14.02,In stock,Four,https://books.toscrape.com/mama-tried-traditional-italian-cooking-for-the-screwed-crude-vegan-and-tattooed_908/index.html
"Lumberjanes, Vol. 2: Friendship to the Max (Lumberjanes #5-8)",£46.91,In stock,Two,https://books.toscrape.com/lumberjanes-vol-2-friendship-to-the-max-lumberjanes-5-8_907/index.html
"Lumberjanes, Vol. 1: Beware the Kitten Holy (Lumberjanes #1-4)",£45.61,In stock,Three,https://books.toscrape.com/lumberjanes-vol-1-beware-the-kitten-holy-lumberjanes-1-4_906/index.html
Lumberjanes Vol. 3: A Terrible Plan (Lumberjanes #9-12),£19.92,In stock,Two,https://books.toscrape.com/lumberjanes-vol-3-a-terrible-plan-lumberjanes-9-12_905/index.html
"Layered: Baking, Building, and Styling Spectacular Cakes",£40.11,In stock,One,https://books.toscrape.com/layered-baking-building-and-styling-spectacular-cakes_904/index.html
Judo: Seven Steps to Black Belt (an Introductory Guide for Beginners),£53.90,In stock,Two,https://books.toscrape.com/judo-seven-steps-to-black-belt-an-introductory-guide-for-beginners_903/index.html
Join,£35.67,In stock,Five,https://books.toscrape.com/join_902/index.html
In the Country We Love: My Family Divided,£22.00,In stock,Four,https://books.toscrape.com/in-the-country-we-love-my-family-divided_901/index.html
Immunity: How Elie Metchnikoff Changed the Course of Modern Medicine,£57.36,In stock,Five,https://books.toscrape.com/immunity-how-elie-metchnikoff-changed-the-course-of-modern-medicine_900/index.html
"I Hate Fairyland, Vol. 1: Madly Ever After (I Hate Fairyland (Compilations) #1-5)",£29.17,In stock,Two,https://books.toscrape.com/i-hate-fairyland-vol-1-madly-ever-after-i-hate-fairyland-compilations-1-5_899/index.html
I am a Hero Omnibus Volume 1,£54.63,In stock,Three,https://books.toscrape.com/i-am-a-hero-omnibus-volume-1_898/index.html
How to Be Miserable: 40 Strategies You Already Use,£46.03,In stock,One,https://books.toscrape.com/how-to-be-miserable-40-strategies-you-already-use_897/index.html
Her Backup Boyfriend (The Sorensen Family #1),£33.97,In stock,One,https://books.toscrape.com/her-backup-boyfriend-the-sorensen-family-1_896/index.html
"Giant Days, Vol. 2 (Giant Days #5-8)",£22.11,In stock,Two,https://books.toscrape.com/giant-days-vol-2-giant-days-5-8_895/index.html
Forever and Forever: The Courtship of Henry Longfellow and Fanny Appleton,£29.69,In stock,Three,https://books.toscrape.com/forever-and-forever-the-courtship-of-henry-longfellow-and-fanny-appleton_894/index.html
First and First (Five Boroughs #3),£15.97,In stock,Four,https://books.toscrape.com/first-and-first-five-boroughs-3_893/index.html
Fifty Shades Darker (Fifty Shades #2),£21.96,In stock,One,https://books.toscrape.com/fifty-shades-darker-fifty-shades-2_892/index.html
Everydata: The Misinformation Hidden in the Little Data You Consume Every Day,£54.35,In stock,Two,https://books.toscrape.com/everydata-the-misinformation-hidden-in-the-little-data-you-consume-every-day_891/index.html
"Don't Be a Jerk: And Other Practical Advice from Dogen, Japan's Greatest Zen Master",£37.97,In stock,Two,https://books.toscrape.com/dont-be-a-jerk-and-other-practical-advice-from-dogen-japans-greatest-zen-master_890/index.html
Danganronpa Volume 1,£51.99,In stock,Four,https://books.toscrape.com/danganronpa-volume-1_889/index.html
Crown of Midnight (Throne of Glass #2),£43.29,In stock,Three,https://books.toscrape.com/crown-of-midnight-throne-of-glass-2_888/index.html
"Codename Baboushka, Volume 1: The Conclave of Death",£36.72,In stock,Four,https://books.toscrape.com/codename-baboushka-volume-1-the-conclave-of-death_887/index.html
Camp Midnight,£17.08,In stock,Four,https://books.toscrape.com/camp-midnight_886/index.html
Call the Nurse: True Stories of a Country Nurse on a Scottish Isle,£29.14,In stock,Five,https://books.toscrape.com/call-the-nurse-true-stories-of-a-country-nurse-on-a-scottish-isle_885/index.html
Burning,£28.81,In stock,Three,https://books.toscrape.com/burning_884/index.html
Bossypants,£49.46,In stock,Two,https://books.toscrape.com/bossypants_883/index.html
"Bitch Planet, Vol. 1: Extraordinary Machine (Bitch Planet (Collected Editions))",£37.92,In stock,Two,https://books.toscrape.com/bitch-planet-vol-1-extraordinary-machine-bitch-planet-collected-editions_882/index.html
"Avatar: The Last Airbender: Smoke and Shadow, Part 3 (Smoke and Shadow #3)",£28.09,In stock,Two,https://books.toscrape.com/avatar-the-last-airbender-smoke-and-shadow-part-3-smoke-and-shadow-3_881/index.html
Algorithms to Live By: The Computer Science of Human Decisions,£30.81,In stock,One,https://books.toscrape.com/algorithms-to-live-by-the-computer-science-of-human-decisions_880/index.html
A World of Flavor: Your Gluten Free Passport,£42.95,In stock,One,https://books.toscrape.com/a-world-of-flavor-your-gluten-free-passport_879/index.html
"A Piece of Sky, a Grain of Rice: A Memoir in Four Meditations",£56.76,In stock,Five,https://books.toscrape.com/a-piece-of-sky-a-grain-of-rice-a-memoir-in-four-meditations_878/index.html
A Murder in Time,£16.64,In stock,One,https://books.toscrape.com/a-murder-in-time_877/index.html
A Flight of Arrows (The Pathfinders #2),£55.53,In stock,Five,https://books.toscrape.com/a-flight-of-arrows-the-pathfinders-2_876/index.html
A Fierce and Subtle Poison,£28.13,In stock,Four,https://books.toscrape.com/a-fierce-and-subtle-poison_875/index.html
A Court of Thorns and Roses (A Court of Thorns and Roses #1),£52.37,In stock,One,https://books.toscrape.com/a-court-of-thorns-and-roses-a-court-of-thorns-and-roses-1_874/index.html
(Un)Qualified: How God Uses Broken People to Do Big Things,£54.00,In stock,Five,https://books.toscrape.com/unqualified-how-god-uses-broken-people-to-do-big-things_873/index.html
You Are What You Love: The Spiritual Power of Habit,£21.87,In stock,Four,https://books.toscrape.com/you-are-what-you-love-the-spiritual-power-of-habit_872/index.html
"William Shakespeare's Star Wars: Verily, A New Hope (William Shakespeare's Star Wars #4)",£43.30,In stock,Four,https://books.toscrape.com/william-shakespeares-star-wars-verily-a-new-hope-william-shakespeares-star-wars-4_871/index.html
Tuesday Nights in 1980,£21.04,In stock,Two,https://books.toscrape.com/tuesday-nights-in-1980_870/index.html
Tracing Numbers on a Train,£41.60,In stock,Three,https://books.toscrape.com/tracing-numbers-on-a-train_869/index.html
Throne of Glass (Throne of Glass #1),£35.07,In stock,Three,https://books.toscrape.com/throne-of-glass-throne-of-glass-1_868/index.html
Thomas Jefferson and the Tripoli Pirates: The Forgotten War That Changed American History,£59.64,In stock,One,https://books.toscrape.com/thomas-jefferson-and-the-tripoli-pirates-the-forgotten-war-that-changed-american-history_867/index.html
Thirteen Reasons Why,£52.72,In stock,One,https://books.toscrape.com/thirteen-reasons-why_866/index.html
The White Cat and the Monk: A Retelling of the Poem “Pangur Bán”,£58.08,In stock,Four,https://books.toscrape.com/the-white-cat-and-the-monk-a-retelling-of-the-poem-pangur-ban_865/index.html
The Wedding Dress,£24.12,In stock,One,https://books.toscrape.com/the-wedding-dress_864/index.html
The Vacationers,£42.15,In stock,Four,https://books.toscrape.com/the-vacationers_863/index.html
The Third Wave: An Entrepreneur’s Vision of the Future,£12.61,In stock,Five,https://books.toscrape.com/the-third-wave-an-entrepreneurs-vision-of-the-future_862/index.html
The Stranger,£17.44,In stock,Four,https://books.toscrape.com/the-stranger_861/index.html
The Shadow Hero (The Shadow Hero),£33.14,In stock,One,https://books.toscrape.com/the-shadow-hero-the-shadow-hero_860/index.html
The Secret (The Secret #1),£27.37,In stock,Four,https://books.toscrape.com/the-secret-the-secret-1_859/index.html
The Regional Office Is Under Attack!,£51.36,In stock,Five,https://books.toscrape.com/the-regional-office-is-under-attack_858/index.html
The Psychopath Test: A Journey Through the Madness Industry,£36.00,In stock,Two,https://books.toscrape.com/the-psychopath-test-a-journey-through-the-madness-industry_857/index.html
The Project,£10.65,In stock,One,https://books.toscrape.com/the-project_856/index.html
The Power of Now: A Guide to Spiritual Enlightenment,£43.54,In stock,Two,https://books.toscrape.com/the-power-of-now-a-guide-to-spiritual-enlightenment_855/index.html
The Omnivore's Dilemma: A Natural History of Four Meals,£38.21,In stock,Two,https://books.toscrape.com/the-omnivores-dilemma-a-natural-history-of-four-meals_854/index.html
The Nerdy Nummies Cookbook: Sweet Treats for the Geek in All of Us,£37.34,In stock,Five,https://books.toscrape.com/the-nerdy-nummies-cookbook-sweet-treats-for-the-geek-in-all-of-us_853/index.html
The Murder of Roger Ackroyd (Hercule Poirot #4),£44.10,In stock,Four,https://books.toscrape.com/the-murder-of-roger-ackroyd-hercule-poirot-4_852/index.html
The Mistake (Off-Campus #2),£43.29,In stock,Three,https://books.toscrape.com/the-mistake-off-campus-2_851/index.html
The Matchmaker's Playbook (Wingmen Inc. #1),£55.85,In stock,One,https://books.toscrape.com/the-matchmakers-playbook-wingmen-inc-1_850/index.html
The Love and Lemons Cookbook: An Apple-to-Zucchini Celebration of Impromptu Cooking,£37.60,In stock,Two,https://books.toscrape.com/the-love-and-lemons-cookbook-an-apple-to-zucchini-celebration-of-impromptu-cooking_849/index.html
The Long Shadow of Small Ghosts: Murder and Memory in an American City,£10.97,In stock,One,https://books.toscrape.com/the-long-shadow-of-small-ghosts-murder-and-memory-in-an-american-city_848/index.html
The Kite Runner,£41.82,In stock,Four,https://books.toscrape.com/the-kite-runner_847/index.html
The House by the Lake,£36.95,In stock,One,https://books.toscrape.com/the-house-by-the-lake_846/index.html
The Glittering Court (The Glittering Court #1),£44.28,In stock,One,https://books.toscrape.com/the-glittering-court-the-glittering-court-1_845/index.html
The Girl on the Train,£55.02,In stock,Two,https://books.toscrape.com/the-girl-on-the-train_844/index.html
The Genius of Birds,£17.24,In stock,One,https://books.toscrape.com/the-genius-of-birds_843/index.html
The Emerald Mystery,£23.15,In stock,Two,https://books.toscrape.com/the-emerald-mystery_842/index.html
The Cookies & Cups Cookbook: 125+ sweet & savory recipes reminding you to Always Eat Dessert First,£41.25,In stock,One,https://books.toscrape.com/the-cookies-cups-cookbook-125-sweet-savory-recipes-reminding-you-to-always-eat-dessert-first_841/index.html
The Bridge to Consciousness: I'm Writing the Bridge Between Science and Our Old and New Beliefs.,£32.00,In stock,Three,https://books.toscrape.com/the-bridge-to-consciousness-im-writing-the-bridge-between-science-and-our-old-and-new-beliefs_840/index.html
The Artist's Way: A Spiritual Path to Higher Creativity,£38.49,In stock,Five,https://books.toscrape.com/the-artists-way-a-spiritual-path-to-higher-creativity_839/index.html
The Art of War,£33.34,In stock,Five,https://books.toscrape.com/the-art-of-war_838/index.html
The Argonauts,£10.93,In stock,Two,https://books.toscrape.com/the-argonauts_837/index.html
The 10% Entrepreneur: Live Your Startup Dream Without Quitting Your Day Job,£27.55,In stock,Three,https://books.toscrape.com/the-10-entrepreneur-live-your-startup-dream-without-quitting-your-day-job_836/index.html
